hotel_id,rating,reviews_count,location,contact,category,amenities,coordinates,thumbnails
ChIJxV9GgX_maC4RK-_noZuOz5w,"4,4","6,9 rb","Jl. Dr. Djundjunan No.22, Sukabungah, Kec. Sukajadi, Kota Bandung, Jawa Barat 40162",(022)82602020,Hotel bintang 3,"Internet: Wi-Fi, Wi-Fi di area publik; Kebijakan & pembayaran: Kartu kredit; Layanan: Resepsionis, Penatu layanan lengkap, Elevator; Parkir & transportasi: Tempat parkir, Parkir valet, Jemputan bandara, Penyewaan mobil di tempat, Antar-jemput lokal; Bisnis & acara: Business center, Ruang rapat; Bahasa yang digunakan: Inggris; Kamar mandi: Pancuran; Makanan & minuman: Restoran, Bar, Room service, Sarapan, Sarapan prasmanan; Anak: Cocok untuk anak; Kolam renang: Tidak menyediakan kolam renang, Tak ada bak air panas; Kesehatan: Tidak memiliki gym, Tidak menyediakan spa; Aksesibilitas: Ramah difabel, Fasilitas parkir difabel; Hewan peliharaan: Hewan peliharaan tidak diizinkan; Kamar: Ber-AC, Mesin pembuat kopi; Efisiensi energi: Penggunaan energi diaudit oleh organisasi independen, Pencahayaan hemat energi; Pengurangan sampah: Program pengurangan sampah makanan, Kelebihan makanan didonasikan, Zat berbahaya ditangani dengan aman, Elektronik, baterai, dan bola lampu dibuang dengan aman, Tidak ada sedotan plastik sekali pakai; Konservasi air: Penggunaan air diaudit oleh organisasi independen, Keran, toilet, dan shower hemat air, Program penggunaan ulang handuk dan linen; Pengambilan sumber daya yang berkelanjutan: Makanan dan minuman organik, Makanan dan minuman dari bahan-bahan lokal, Telur organik dari unggas yang dipelihara tanpa kandang, Hidangan vegetarian, Perlengkapan mandi ramah lingkungan; ","Lat: -6.8998084, Lng: 107.5960787",http://lh5.googleusercontent.com/p/AF1QipNIWR3PvdHYBvCpRAHn5TB3yJ9ofXIaChW4pQEK=w252-h189-k-no; http://lh5.googleusercontent.com/p/AF1QipNqivS_mRYVaj-zNWVMf-JSKu7yOLGSR9cmX13a=w252-h167-k-no; http://lh3.googleusercontent.com/proxy/Uw_vvdhFM6S71ED0MJM9fRboQFtfiIStyJb3Oldd7y9_a_2Hf8b6LYnD3QM3innTuRc2NdHnVShP-fb7KGDRXsWYEv41OYHIsU4g2PkTuSopMUqxxqS1hn8QgVCHQPNaq64GOkR7pIoh1wiOLE0hbHvntOonLw=w252-h168-k-no
ChIJ_U1EujfmaC4RwBpUSN7M6SI,"4,6","9,1 rb","Jl. Sumatera No.51, Citarum, Kec. Bandung Wetan, Kota Bandung, Jawa Barat 40115",(022)4211234,Hotel bintang 5,"Kolam renang: Kolam renang luar, Tak ada bak air panas; Internet: Wi-Fi, Wi-Fi di area publik, Tempat kerja dengan internet publik; Kebijakan & pembayaran: Kartu kredit, Kartu debit, Tunai; Layanan: Resepsionis, Penyimpanan bagasi, Concierge, Minimarket, Penatu layanan lengkap, Elevator, Layanan membangunkan, Toko suvenir, Tata graha; Parkir & transportasi: Tempat parkir, Parkir mandiri, Penyewaan mobil di tempat, Antar-jemput lokal; Aksesibilitas: Ramah difabel; Bisnis & acara: Business center, Ruang rapat; Bahasa yang digunakan: Inggris, Indonesia; Kamar mandi: Kamar mandi pribadi, Bak mandi, Pancuran; Makanan & minuman: Restoran, Bar, Pesan tempat makan, Makan malam prasmanan, Room service, Sarapan, Sarapan prasmanan; Aktivitas: Tenis, Toko butik; Anak: Cocok untuk anak, Aktivitas untuk anak, Klub anak-anak; Kesehatan: Gym, Mesin eliptik, Treadmill, Mesin beban, Angkat beban, Sauna, Tidak menyediakan spa, Dokter panggilan; Hewan peliharaan: Hewan peliharaan tidak diizinkan; Kamar: Ber-AC, Lemari es, Minibar; ","Lat: -6.909732, Lng: 107.611708",http://lh4.googleusercontent.com/proxy/x_gzCWnjtVSGMKOF5PidS8BdLZ4BhkKaxG_Zat-T2KZxrE7xIZC4Dkv53Agp0aefys_c71w3ICl1h1CImVLApjeRo5FaaQyC936TOixsZQMtEzao4hRrRtFwIQ6l7Jt9eBTK3mmXIO-DBJdmsgu_tXQ3xTkaIvo=w252-h168-k-no; http://lh5.googleusercontent.com/proxy/_YulLRoVoj_KV_yE6dnA45VxKFISischB3d1eGlV4mNlcYGy YW2DkxV9C2agsaKNiTQJH2IDruMg_W6kh5tLXS7kK5M-JqyQlehxzbpucEhl9gr9cByzM85vRiNjI65eaArpc9BMSujBYZXtJMdZ6AnrKhZFvA=w252-h168-k-no; http://lh5.googleusercontent.com/proxy/D7dj12aydE0aIsVxkz0vKWWEBVQiwPUc4vMDiEDPdL6HRKKsroB0e9UAjZPlf-Zcd9TtfIq26CEWjjGQViiTtJw4Z3D6TZnOEOraF_z0SVnX6SD0rND-ob0grO_241hW0w7qiinSINeep6t_igf4rOVJh5JF7A=w252-h168-k-no
ChIJ20GDvkrmaC4RZ5E1cUQ-k8A,"4,3","3,9 rb","Jl. L. L. R.E. Martadinata No.62, Citarum, Kec. Bandung Wetan, Kota Bandung, Jawa Barat 40115",(022)4263335,Hotel bintang 3,"Kolam renang: Kolam renang luar, Tak ada bak air panas; Internet: Wi-Fi, Wi-Fi di area publik; Kebijakan & pembayaran: Kartu kredit, Kartu debit, Tunai; Anak: Cocok untuk anak; Parkir & transportasi: Tempat parkir, Parkir valet, Jemputan bandara, Antar-jemput lokal; Bisnis & acara: Ruang rapat; Bahasa yang digunakan: Inggris, Indonesia; Kamar mandi: Pancuran; Makanan & minuman: Restoran, Pesan tempat makan, Makan malam prasmanan, Room service, Sarapan, Sarapan prasmanan; Layanan: Resepsionis, Penyimpanan bagasi, Concierge, Penatu layanan lengkap, Elevator, Layanan membangunkan, Tata graha; Kesehatan: Gym, Spa; Aksesibilitas: Ramah difabel; Hewan peliharaan: Hewan peliharaan tidak diizinkan; Kamar: Ber-AC, Minibar di beberapa kamar; Efisiensi energi: Program konservasi energi, Pencahayaan hemat energi; ","Lat: -6.906334699999999, Lng: 107.6202485",http://lh4.googleusercontent.com/proxy/ST8rhqNGcLnX7r9eDVQpZFRavON8LNrO00RJvazJiB8iBMOWK7OYV5T77NFBpHX3FsvdkCFPDoZ3h9cezmwaElcGGM8Ks9-zpV6En5LKzfGSfD84s-usSFsvG2RJISMrsdMzZ5s2jB-3el0MfaGd0xinYi8SnQ=w252-h189-k-no; http://lh5.googleusercontent.com/p/AF1QipPGcFY0VQSoQ1P04GAKe5rEUoa-XDJygE7icJw0=w252-h192-k-no; http://lh5.googleusercontent.com/proxy/IpHrzIsSSH-LV0ID-cWU59AeNZHD4UdryPZ_dOU1SPViD3-gDHUDDzeB-tVEZw4185kiAx8Z6d85aVIASdxNNnCW7msTK43zfFY2WpocMJA_FBVii8NSdf-OAi7MH9XS2DSY1FooSn020zBRd-HTlby5g6M_SD0=w252-h185-k-no
ChIJE1iDjRbmaC4RqlPUx4rQp5c,4,685,"Hyper Squere, Jl. Pasir Kaliki No.29-32 Blok D, Kb. Jeruk, Kec. Andir, Kota Bandung, Jawa Barat 40181",81233009098,Hotel bintang 3,"Internet: Wi-Fi; Layanan: Resepsionis, Penatu layanan lengkap; Kolam renang: Tidak menyediakan kolam renang, Tak ada bak air panas; Kesehatan: Tidak memiliki gym, Tidak menyediakan spa; Makanan & minuman: Restoran, Room service, Sarapan, Sarapan prasmanan; Anak: Cocok untuk anak; Parkir & transportasi: Tempat parkir; Kamar: Ber-AC; ","Lat: -6.914458499999999, Lng: 107.5940178",http://lh5.googleusercontent.com/p/AF1QipOMVDFmTJJnyscd_a5Bqpis5B6fKdgXNliYKqAg=w252-h189-k-no; http://lh5.googleusercontent.com/p/AF1QipMoLYVGXhYxMemzqlhnVPuHVLtMuIXgHYuwpQz_=w252-h189-k-no; http://lh5.googleusercontent.com/proxy/3YroebRTMqOi2phAYcGrEAtHhLFAOSbG36V41z-Y8Edi8oDiMggCAMS_4hNdm7KAhi3HR57Klm5vbkQTjAQN2k_eVnIwHPGJOsU3mwdwNydxmPYnToBxJGTriEKFbhhhdeuW6KsMkC2cRAQUOJaUNvQBSd9bDg=w252-h167-k-no; http://lh5.googleusercontent.com/p/AF1QipPvJIkglCg8apHmnMqeMf79JyqaHM8FH1Qx6UN4=s367-w367-h248-n-k-no; http://lh5.googleusercontent.com/p/AF1QipNm5crLuGESu2PUXEXdJbGtGH8vdz-9gFicmtS1=s367-w367-h248-n-k-no; http://lh5.googleusercontent.com/p/AF1QipNyf8lWr8HlwySjNNa9Wqa4zG4Rx93imZI7iblU=s367-w367-h248-n-k-no; http://lh5.googleusercontent.com/p/AF1QipP9x6qTl9wZxZpmSN8NEgeCogj0TNPy7a3S9BJG=s367-w367-h248-n-k-no; http://lh5.googleusercontent.com/p/AF1QipPWTPclskNGgNvJQw4HVsDxw6Uu5lWkZzoKUTcY=s367-w367-h248-n-k-no
ChIJPSaLsGXmaC4RtPcXs-Ng3S4,"4,7","19,2 rb","Jl. Dr. Djundjunan No.96, Pasteur, Kec. Sukajadi, Kota Bandung, Jawa Barat 40162",(022)2060123,Hotel bintang 4,"Kolam renang: Kolam renang di dalam ruangan, Kolam renang luar, Kolam berendam, Bak air panas; Internet: Wi-Fi, Wi-Fi di area publik; Layanan: Resepsionis, Concierge, Penatu layanan lengkap, Toko suvenir, Tata graha; Aksesibilitas: Ramah difabel, Fasilitas parkir difabel; Bisnis & acara: Business center, Ruang rapat; Bahasa yang digunakan: Inggris, Indonesia; Kamar mandi: Kamar mandi pribadi; Makanan & minuman: Restoran, Bar, Room service, Sarapan, Sarapan prasmanan; Anak: Cocok untuk anak, Aktivitas untuk anak; Parkir & transportasi: Tempat parkir, Parkir valet, Jemputan bandara; Kesehatan: Gym, Treadmill, Angkat beban, Spa; Hewan peliharaan: Hewan peliharaan tidak diizinkan; Kamar: Ber-AC, Mesin pembuat kopi; ","Lat: -6.8960897, Lng: 107.5906402",http://lh5.googleusercontent.com/p/AF1QipOplct8uJpfps0Zyq2-TAQ6o8vRKuiFnKa9dBdT=w252-h167-k-no; http://lh3.googleusercontent.com/gvs/AG4uZQm5FGWMlxU4h8H-QGPswt3fm43ydxW2l4X9-O2qADlNcVZgDXXUmcUqk5Go8mh5wwrWAtqh0lV9UAVrnex6_rqBoOHMAshcyB4o; http://lh5.googleusercontent.com/proxy/pca9cR0F3jovhxMbH0bYd2D3KRthYSBgjWSMF3FC26HznWXTjAfWSAmyiqleLkGV6I8qGlZmTs43TL9zRGNy5qZRfbpqStL-aw0RvRe3vtEhh-GIQrzWerXw9CxtvLcbjD3eezphIw3RReRDV5Wq_SWTHnMDGQ=w252-h168-k-no; http://lh5.googleusercontent.com/p/AF1QipMPTKmQeQcmwNwfMgkeALtb8cuTcveAHTlBX0VF=s367-w367-h248-n-k-no; http://lh5.googleusercontent.com/p/AF1QipMok1S-4XAMdlYGRUJ_baMdAieS5GzoLvVn8U2G=s367-w367-h248-n-k-no
ChIJSygxoDXmaC4RXqifutvyKow,"4,3","4,3 rb","Jl. Aceh No.71A, Citarum, Kec. Bandung Wetan, Kota Bandung, Jawa Barat 40115",(022)4222221,Hotel bintang 4,"Kolam renang: Kolam renang luar, Tak ada bak air panas; Internet: Wi-Fi; Layanan: Resepsionis, Penatu layanan lengkap; Kesehatan: Gym, Sauna, Spa, Salon rambut; Kamar: Ber-AC; Makanan & minuman: Restoran, Room service, Sarapan, Sarapan prasmanan; Anak: Cocok untuk anak; Parkir & transportasi: Tempat parkir, Jemputan bandara; Aksesibilitas: Ramah difabel; Hewan peliharaan: Hewan peliharaan tidak diizinkan; ","Lat: -6.908662, Lng: 107.6184869",http://lh5.googleusercontent.com/p/AF1QipPC4xnxccHJx4CebFj4PBVzzIP1wG9UhfslGtvl=w252-h168-k-no; http://lh5.googleusercontent.com/p/AF1QipMspdGbc4oInzcGqbivJ2gPFERHWepYa0Vvpvrp=w252-h168-k-no; http://lh5.googleusercontent.com/p/AF1QipOV3_tCqmeZwXXoly57KiZ3y_PK-7mcVZk5193e=w252-h168-k-no
ChIJYzQtuz7maC4Rcf2QiM5xvMc,"4,2","4,2 rb","Jl. Kebon Kawung No.16, Pasir Kaliki, Kec. Cicendo, Kota Bandung, Jawa Barat 40171",(022)4268731,Hotel bintang 3,"Kolam renang: Kolam renang luar, Kolam berendam, Tak ada bak air panas; Internet: Wi-Fi; Layanan: Resepsionis, Penatu layanan lengkap; Kesehatan: Tidak memiliki gym, Spa; Hewan peliharaan: Hewan peliharaan tidak diizinkan; Makanan & minuman: Restoran, Room service, Sarapan, Sarapan prasmanan; Anak: Cocok untuk anak; Parkir & transportasi: Tempat parkir, Jemputan bandara; Aksesibilitas: Ramah difabel; Kamar: Ber-AC; ","Lat: -6.9123731, Lng: 107.6027986",http://lh5.googleusercontent.com/proxy/6z6-Xpo7-9DCl9AngWRgBIO0VlruU_qkZEOpyQzMZml0VGqSYEOXiziPv9J8TiFdsZ1F2BABPIznmNnXzR6P5caWWLTjKH-6f1Fge3aykrwR9MvnONitPrBK14ezONFSHXEGXJvJl0mVIeZP79-MWMMcpH6SjA=w252-h189-k-no; http://lh5.googleusercontent.com/proxy/bTMXOKY4aZOUjZP-dzMoKm5JE1PT3N24Xwz1Ebp85Px73AI3QGMq5TRg6LWkabitvVsMgEF0gBnTig_8muKX4hF_enkxMw2FAQ6JDZkyVj31V7QnxO7jrXwV-4-9bN1ndejxWeS0zn4fNEtKV-11P8CPKOiKM5A=w252-h167-k-no; http://lh3.googleusercontent.com/gvs/AG4uZQk-jbrLbJN07AjDiL_c2Fg0ba9Qx3QD2EKpU4i6rMgmAo_XRZ6wJ1krcehECwbst0qhhgjuPwgbj9-Po4GD6iiFZkMdKz2HewXY; http://lh5.googleusercontent.com/p/AF1QipMUD0vJzgcOpTPbl9BuOSp7wkpRiKUj259Ff_fx=s367-w367-h248-n-k-no; http://lh5.googleusercontent.com/p/AF1QipNoBsctSZlo0kYrbBswJNgAnorHNVTk2N8fM1X_=s367-w367-h248-n-k-no; http://lh5.googleusercontent.com/p/AF1QipPjcV6wb9R-NcaCgEVsB27-hOabaZ-cbYgIktkZ=s367-w367-h248-n-k-no; http://lh5.googleusercontent.com/p/AF1QipP0gnGfKah2hoxsFljBmt905IDqtyWUCqTZemzd=s367-w367-h248-n-k-no; http://lh5.googleusercontent.com/p/AF1QipMFIaR9lQcBvdytx3Lq9R-klvnyWtj_g6DGraOo=s367-w367-h248-n-k-no; http://lh5.googleusercontent.com/p/AF1QipP_lwN0neKWP7vt3OXOLM6hZFaXB4GRbGoWQ6zv=s367-w367-h248-n-k-no; http://lh5.googleusercontent.com/p/AF1QipN-twzIVAouAUegoDY-30zX3wBn956mEKMCEnMf=s367-w367-h248-n-k-no; http://lh5.googleusercontent.com/p/AF1QipNd8MO0ybfHHoh2G-MwVwWqRTu4i4N3tcxdnUKl=s367-w367-h248-n-k-no
ChIJWQE7xCjmaC4RkgWggJah1no,"4,5","7,5 rb","Jl. Lengkong Besar No.8, Cikawao, Kec. Lengkong, Kota Bandung, Jawa Barat 40261",(022)30008000,Hotel bintang 4,"Kolam renang: Kolam renang luar; Internet: Wi-Fi, Wi-Fi di area publik; Layanan: Resepsionis, Concierge, Penatu layanan lengkap, Elevator, Layanan membangunkan; Parkir & transportasi: Tempat parkir, Jemputan bandara; Aksesibilitas: Ramah difabel, Fasilitas parkir difabel; Hewan peliharaan: Hewan peliharaan tidak diizinkan; Kamar: Ber-AC, Mesin pembuat kopi, Minibar; Makanan & minuman: Restoran, Bar, Room service, Sarapan, Sarapan prasmanan; Anak: Cocok untuk anak; Kesehatan: Gym, Tidak menyediakan spa; Bisnis & acara: Ruang rapat; Bahasa yang digunakan: Inggris, Indonesia; Kamar mandi: Kamar mandi pribadi, Pancuran; Efisiensi energi: Penggunaan energi diaudit oleh organisasi independen, Pencahayaan hemat energi; Pengurangan sampah: Zat berbahaya ditangani dengan aman, Elektronik, baterai, dan bola lampu dibuang dengan aman, Tidak ada sedotan plastik sekali pakai; Konservasi air: Penggunaan air diaudit oleh organisasi independen, Keran, toilet, dan shower hemat air, Program penggunaan ulang handuk dan linen; Pengambilan sumber daya yang berkelanjutan: Makanan dan minuman dari bahan-bahan lokal, Perlengkapan mandi ramah lingkungan; ","Lat: -6.9238326, Lng: 107.6113519",http://lh5.googleusercontent.com/proxy/ChqVZvHrZqdQvyT4zd20eCRuN53l_Xt3rY6yKzk_pmwlT01sGkKo86NRHvtGycvPt3EA2F_03DywN2SF1h4pxRNaArg6ZfoMV3c2ftpDEUodc8hZh2n-g5rRXHF2t4LPrTshPSnig85FJG63AfbfrtZW-oCMkiQ=w252-h189-k-no; http://lh3.googleusercontent.com/gvs-cs/APtdFEiXxvJLVx3Uugl7Vc-Fz2-cJE_yeTOPT7CrTrtmWh14jaexrve_3o_lLNLZNBHJEmlXLAi_yjUEJA8jRbNOp5FkOeG75qGfIAA8_xv681y4SKwICnKR45fKuJh2CikwhvizkNPpHQ; http://lh3.googleusercontent.com/proxy/WMoC4Yy-TKqsoU2smJc0CfqwhcbeuLZ9zPAQVOx5K8S4GimU8kDuNuSxxZbtoov0g0OOQKc_PhJbnq1CRiYWmuv659DZsPxOVi929SyeSaM3rCPdKZBLkQuxQGcx2PZq6qd-7Q0QdM4agTD_O-PMddn-Mzh7Yg=w252-h190-k-no; http://lh5.googleusercontent.com/p/AF1QipO81Ml9OFsWJuCZk5EGMxAYnJz4Bn09THZguLak=s367-w367-h248-n-k-no; http://lh5.googleusercontent.com/p/AF1QipOl47XC0fDwPbkhl-1Tjh8k7A1pm8rKQN81DWkL=s367-w367-h248-n-k-no; http://lh5.googleusercontent.com/p/AF1QipNFjU3TxIMzAAbGeHt95zP6wWbvVqAsl8HwFkwn=s367-w367-h248-n-k-no; http://lh5.googleusercontent.com/p/AF1QipMrdoZw59W3Nf_Wt1uJkIHLFAIusega3gfmLmDS=s367-w367-h248-n-k-no; http://lh5.googleusercontent.com/p/AF1QipOyd4hb4lPKI-lSBdwTlpzgKw-7h1yr1tj_iUuF=s367-w367-h248-n-k-no; http://lh5.googleusercontent.com/p/AF1QipNOqUyRlaDk2dEhD4DiN6fehfKIAhKcRqnqg8vv=s367-w367-h248-n-k-no; http://lh5.googleusercontent.com/p/AF1QipPN2MBYG28sUz0Tzl5506t_OMwaw0zjMyCdZXoo=s367-w367-h248-n-k-no; http://lh5.googleusercontent.com/p/AF1QipMHIL4gd0OqkXv64ecNjifdBfPvhaRyRCM76ulX=s367-w367-h248-n-k-no; http://lh5.googleusercontent.com/p/AF1QipN2E1nE2adV_H60tzLe_-xernXB1pe6IdmwBwPr=s367-w367-h248-n-k-no; http://lh5.googleusercontent.com/p/AF1QipNYNTkwNqh_uMugwGeR8t5LjermLw17Wt28UfS9=s367-w367-h248-n-k-no; http://lh5.googleusercontent.com/p/AF1QipO_ze7w8wqQ1Qc48sbwXOvyHQeeNDf4hxDQMwx6=s367-w367-h248-n-k-no; http://lh5.googleusercontent.com/p/AF1QipN-F7Z9AQylvqUn3l2azwb_a7ni5sqmpbSLPnRu=s367-w367-h248-n-k-no; http://lh5.googleusercontent.com/p/AF1QipPeXKzRPFvaPQmusi1i0eAhYA8MabSs85TVBgwr=s367-w367-h248-n-k-no; http://lh5.googleusercontent.com/p/AF1QipOocC6VhiLmL9FD9C-XUR0h2k3GHS0ogGnipRQi=s367-w367-h248-n-k-no; http://lh5.googleusercontent.com/p/AF1QipMBhS_K5lzMrrXr2jbp0Sta4FlrxBmBfsmAi8S9=s367-w367-h248-n-k-no; http://lh5.googleusercontent.com/p/AF1QipNuxv5zYdokdjM74knm61z_IzVXIY6vO-wQ9pNV=s367-w367-h248-n-k-no; http://lh5.googleusercontent.com/p/AF1QipMmenFCv2JirX8ndZJRL8850EhTOlsrjh1gxMlS=s367-w367-h248-n-k-no
ChIJCSYyqzrmaC4R_bQ3y9Njhps,"4,3","6,1 rb","Jl. Braga No.99-101, Braga, Kec. Sumur Bandung, Kota Bandung, Jawa Barat 40111",(022)84468222,Hotel bintang 3,"Internet: Wi-Fi; Layanan: Resepsionis, Penatu layanan lengkap; Kolam renang: Tidak menyediakan kolam renang, Tak ada bak air panas; Kesehatan: Tidak memiliki gym; Bisnis & acara: Ruang rapat; Kamar: Ber-AC; Makanan & minuman: Restoran, Sarapan, Sarapan prasmanan; Anak: Cocok untuk anak; Parkir & transportasi: Tempat parkir, Jemputan bandara, Antar-jemput lokal; Aksesibilitas: Ramah difabel; Hewan peliharaan: Hewan peliharaan tidak diizinkan; ","Lat: -6.916962900000001, Lng: 107.609098",http://lh5.googleusercontent.com/p/AF1QipOk1J0Nbtta6Py6YXi7_wroNOMPl-oUAMo2sFKl=w252-h152-k-no; http://lh3.googleusercontent.com/proxy/sutmt3o3hSBY7PfW0EH8nxr0jhMhsAWA5JOTySfOCw9ql4 62GQ6zGDbtLjoVmUEvmc8gTFsOrjzDlCYQXR5IfNWfk-8yCyHatMYxllVxnoo35A-5l1KhUHecWN6H43UAK93QFhQcgvG2D4WmjN4zj0c-GiJIUg=w252-h163-k-no; http://lh3.googleusercontent.com/proxy/yktFg1fflaw_1si-QTmcUl-u79WCu2agevejU4eBQOG2FR-85-x_ny265ihj-Ss0muyFG9dLW4aDuxxE_e4Fi_x8tynwD6TX9YiowOqmxBoFh5QhnNfBU1eWp95VHrB3EZGglclEY5pfsal37TvVQAzAUZn8HA=w252-h167-k-no
ChIJJbG2YEznaC4Rwt5LRAfMsG8,"4,3",990,"Jl. Konstitusi I No.16, Cigadung, Kec. Cibeunying Kaler, Kota Bandung, Jawa Barat 40191",82120339805,Hotel bintang 3,"Kolam renang: Kolam renang luar, Tak ada bak air panas; Internet: Wi-Fi; Layanan: Resepsionis; Kesehatan: Tidak memiliki gym, Tidak menyediakan spa; Kamar: Ber-AC; Makanan & minuman: Room service, Sarapan, Sarapan prasmanan; Anak: Cocok untuk anak; Parkir & transportasi: Tempat parkir, Jemputan bandara; Hewan peliharaan: Boleh bawa hewan peliharaan; ","Lat: -6.8842806, Lng: 107.6255493",http://lh3.googleusercontent.com/proxy/64vcsD4W3qpwfxGxbPGb8uLiG4bMDfrH-mdgPBgj7T18rjbU-4w5Dg_AErUaolfMRpu4DreCd4VQWj6oEubc9kVc_7og7WXFCb60SGSs4QMrCP_nHsFbPlGpmpXsnD4FT1XtNNa22sr8rwUBCRSwy7-ajglfAA=w252-h166-k-no; http://lh3.googleusercontent.com/proxy/SupzYJtl8pWu6WHN2i-ZIVgCqI8636eiu4UF_4X8PT5p1nKSiPOSrUVqCijEneUbOYhiNCbZhSXdigreuMwI_wrEQt9IbbRpBmQGjW9gU6zE-mv5EA3gulezF-YLGTpjDiFVO4HvxoZBE-HPrW22oLj5RWyda1g=w252-h189-k-no; http://lh6.googleusercontent.com/proxy/ZyHdYqOQIZRwMOMmz31gFYrWe9vuZhE0up5ERW6khS8MP_nMoOlzStdOdCXxxMcX276qwYBKmTE6VimYk2B3NUa4AEiZ-P9iDNFID_ufv8iwJJ66DlXJI19JfW00zvgHppZklnEvwlhVcxXRk3XqelwbvRS3oas=w252-h189-k-no
ChIJSdzPDUjmaC4RFjiu4ncFmaI,"4,5","6,1 rb","Jl. Ir. H. Juanda No.3, Tamansari, Kec. Bandung Wetan, Kota Bandung, Jawa Barat 40116",(022)4260966,Hotel bintang 4,"Kolam renang: Kolam renang di dalam ruangan, Tak ada bak air panas; Internet: Wi-Fi, Wi-Fi di area publik; Kebijakan & pembayaran: Properti bebas rokok, Kartu kredit, Kartu debit, Tunai; Anak: Cocok untuk anak, Aktivitas untuk anak; Parkir & transportasi: Tempat parkir, Parkir mandiri, Parkir valet; Aksesibilitas: Ramah difabel; Hewan peliharaan: Hewan peliharaan tidak diizinkan; Bahasa yang digunakan: Inggris, Indonesia; Kamar mandi: Kamar mandi pribadi, Pancuran; Makanan & minuman: Restoran, Room service, Sarapan, Sarapan prasmanan; Aktivitas: Penyewaan sepeda; Layanan: Resepsionis, Penyimpanan bagasi, Concierge, Penatu layanan lengkap, Jam sosial, Layanan membangunkan, Tata graha; Kesehatan: Gym, Treadmill, Mesin beban, Angkat beban, Spa; Bisnis & acara: Business center, Ruang rapat; Kamar: Ber-AC, Lemari es, Mesin pembuat kopi; ","Lat: -6.906296999999999, Lng: 107.610312",http://lh5.googleusercontent.com/p/AF1QipOZW5_4FvR8lvLOu0iuJcEIp8nvk4N4KedOfrdJ=w252-h168-k-no; http://lh4.googleusercontent.com/proxy/RcNQdbWCsyVzvQ2oK2Kc1hMw_77WdO1QQqptOHiIjf626RnSEuqBLjyyv82k3KMPOBcYuhqZVpk89lM8hSya2PipQHO0VE0Ke3S7Fu3fr0v-FnEU8tTT4t4xcezMrtm9qD3NaHrmZMDepjDXt0vt_nni92FXc6U=w252-h168-k-no; http://lh5.googleusercontent.com/p/AF1QipOqGSZ4iScispxQZIFLcUjaZAw6rehfTrqRmDMb=w252-h168-k-no
ChIJww_i8rLnaC4R83Ta37V3YWs,"4,3",161,"Paskal Shopping Center, Ciroyom, Kec. Andir, Kota Bandung, Jawa Barat 40182",(022)86060940,Hotel bintang 3,"Internet: Wi-Fi; Layanan: Resepsionis, Penatu layanan lengkap; Parkir & transportasi: Tempat parkir; Kebijakan & pembayaran: Kartu kredit, Kartu debit; Kolam renang: Tidak menyediakan kolam renang, Tak ada bak air panas; Kesehatan: Tidak memiliki gym, Tidak menyediakan spa; ","Lat: -6.9158396, Lng: 107.592679",http://lh5.googleusercontent.com/p/AF1QipPJD5ouVEdiitRcPOZhJ_T4OjpLtrYOxBI4vgQh=w252-h164-k-no; http://lh5.googleusercontent.com/p/AF1QipPJD5ouVEdiitRcPOZhJ_T4OjpLtrYOxBI4vgQh=w252-h164-k-no; http://lh5.googleusercontent.com/proxy/6OrY4JnayJx5dXcAdM3IiESnp0iXy0RDE1eI2gmegiK-NP65beZm6DLuQfFF96vTuH0DL0hxEMzhyDtzx5ptEvMA-31y476hmkVU7uSh8B-NTW_COhwW7c0nsgp5FJcG5-jWPRl4Lo-4VmqofZRGp80At5su5A=w252-h158-k-no
ChIJ749SfFvmaC4RqQOgFQkkvms,"4,1","1,7 rb","Jl. Cihampelas No.108, Tamansari, Kec. Bandung Wetan, Kota Bandung, Jawa Barat 40116",(022)82062333,Hotel bintang 2,"Internet: Wi-Fi; Layanan: Resepsionis, Penatu layanan lengkap; Kolam renang: Tidak menyediakan kolam renang, Tak ada bak air panas; Kesehatan: Tidak memiliki gym, Tidak menyediakan spa; Makanan & minuman: Restoran, Sarapan, Sarapan prasmanan; Anak: Cocok untuk anak; Parkir & transportasi: Tempat parkir; Hewan peliharaan: Hewan peliharaan tidak diizinkan; Kamar: Ber-AC; ","Lat: -6.8984502, Lng: 107.6043551",http://lh5.googleusercontent.com/p/AF1QipOy51moZowA4pAVKqPodTG42R8qdWkjaGFumVzz=w252-h198-k-no; http://lh6.googleusercontent.com/proxy/cZXfjsV9E7O6XQdKEP1n8j7lDPgj7ieHLUA_Ex3nq1rXe8vmbiTxDNOXJv9k6CzYGOoTQuWOcEbVE8JUDf7q8KilPJDzNN31keAGAqhm3wUmkwIJZvWKWJ6uhRnxx4XZw3MlrjxoMgGXolZZUG0AJdRFGa3Hg3k=w252-h170-k-no; http://lh4.googleusercontent.com/proxy/BljDte9zgNryG2LFaViijYYhii0p4o1QrCZHuaHOp8cNB5QVPwby4L9q1vzU127OFc0dw_kS-b8P5YgUwuqn9nMwbSG-tMLqjnPcqV9cgAqIwWgTE0jPDcQ5Uk64oqWwz35pN3p1Gz1jfGPF3E5azK_HZ3Yd7Tk=w252-h168-k-no; http://lh5.googleusercontent.com/p/AF1QipN3MP9b69WIQogYDJb1FWatJY3fCT1k0ZGcXfZS=s367-w367-h248-n-k-no; http://lh5.googleusercontent.com/p/AF1QipM96nkAPjR1ZWNNCLRlww5ZKBjyb_TrAWdcJKdO=s367-w367-h248-n-k-no; http://lh5.googleusercontent.com/p/AF1QipOrq33EaESs5nXoGChWg5JrZ21G7bOgLluH7IpY=s367-w367-h248-n-k-no; http://lh5.googleusercontent.com/p/AF1QipOhbOwmGXxOV2uId_8RdXIh_rHlk3zVZuedtXm-=s367-w367-h248-n-k-no; http://lh5.googleusercontent.com/p/AF1QipNK2t3mg5m7VsKlFtPkWmhFOXvjjlVLoGJ4ApaP=s367-w367-h248-n-k-no
ChIJJ60nFVTmaC4Rx9xG19vR8zQ,"4,6","5,6 rb","Jl. Dipati Ukur No.72 - 74, Lebakgede, Kecamatan Coblong, Kota Bandung, Jawa Barat 40132",(022)82526166,Hotel bintang 3,"Internet: Wi-Fi, Wi-Fi di area publik; Kebijakan & pembayaran: Kartu kredit, Kartu debit, Tunai; Anak: Cocok untuk anak; Parkir & transportasi: Tempat parkir, Jemputan bandara, Antar-jemput lokal; Aksesibilitas: Ramah difabel, Fasilitas parkir difabel, Lift bagi difabel; Hewan peliharaan: Hewan peliharaan tidak diizinkan; Makanan & minuman: Restoran, Room service, Sarapan, Sarapan prasmanan; Layanan: Resepsionis, Penatu layanan lengkap; Kolam renang: Tidak menyediakan kolam renang, Tak ada bak air panas; Kesehatan: Tidak memiliki gym, Pijat, Tidak menyediakan spa, Dokter panggilan; Bisnis & acara: Ruang rapat; Kamar: Ber-AC; ","Lat: -6.889812099999999, Lng: 107.6164407",http://lh3.googleusercontent.com/proxy/dzg6oKoVnnTsDp0BbZtT3BqA58hLC_DZspmDIrqsZi5VDUDSgeT7LSz30rc8aqlLxJUyrOy6pmhqN8CemBQjCW1x2-WAW7nQ0hLdec3qpBbSrCmKeLxvZptCgn5eToHGa-nKgx1Ma275aZMdaw2htMBDXI8V6hM=w252-h167-k-no; http://lh3.googleusercontent.com/proxy/dzg6oKoVnnTsDp0BbZtT3BqA58hLC_DZspmDIrqsZi5VDUDSgeT7LSz30rc8aqlLxJUyrOy6pmhqN8CemBQjCW1x2-WAW7nQ0hLdec3qpBbSrCmKeLxvZptCgn5eToHGa-nKgx1Ma275aZMdaw2htMBDXI8V6hM=w252-h167-k-no; http://lh4.googleusercontent.com/proxy/PkBGIRZGbwI1uT-os7CjRQSe1JuvTRj2G-88a8VC_7GE-4E3hxYLFuZwBcMOJA_XknrG18coiR8FBIJX5uSYs2-d-qFjUxIxD1yKfrGK7mLux2qPBeFUFHCY-i8jNETejC5aWaKYF7gqvQhl152jhXigeKEbTA=w252-h168-k-no; http://lh5.googleusercontent.com/p/AF1QipOfzQJeQ9bsSH8ZKFwRfWNM6u7aVODI1BGHKfv7=s367-w367-h248-n-k-no; http://lh5.googleusercontent.com/p/AF1QipMV17isF0Bg7gtfkHYOp1gGVwZo5nne2ZjsRi6Z=s367-w367-h248-n-k-no; http://lh5.googleusercontent.com/p/AF1QipOJN_tUSp0sOaiuxF5jXa1febmThUlz_M6AHZkz=s367-w367-h248-n-k-no; http://lh5.googleusercontent.com/p/AF1QipPFQkKcptC3kn5yVRmc8jiZJ1cWednL1saXmR8R=s367-w367-h248-n-k-no; http://lh5.googleusercontent.com/p/AF1QipP__b9kfTmrkkEzpK51iZlgAUAoI8ZnO0ARHOIN=s367-w367-h248-n-k-no
ChIJFaWBwYXmaC4Ro89xYHJZjUI,"4,5","6,3 rb","Jl. Terusan Ir. Sutami III, Sukagalih, Bandung, Bandung City, West Java 40163",(022)2006789,Hotel bintang 3,"Kolam renang: Kolam renang luar, Kolam renang khusus dewasa, Tak ada bak air panas; Internet: Wi-Fi; Kebijakan & pembayaran: Kartu kredit, Kartu debit, Tunai; Anak: Cocok untuk anak; Parkir & transportasi: Tempat parkir, Jemputan bandara, Layanan mobil pribadi, Penyewaan mobil di tempat, Antar-jemput lokal; Bisnis & acara: Business center, Ruang rapat; Bahasa yang digunakan: Inggris, Indonesia; Makanan & minuman: Restoran, Room service, Sarapan, Sarapan prasmanan; Layanan: Resepsionis, Penyimpanan bagasi, Concierge, Minimarket, Kurs mata uang, Penatu layanan lengkap, Elevator, Layanan membangunkan, Toko suvenir, Tata graha; Kesehatan: Gym; Aksesibilitas: Ramah difabel; Hewan peliharaan: Hewan peliharaan tidak diizinkan; Kamar: Ber-AC; ","Lat: -6.881683, Lng: 107.584429",http://lh5.googleusercontent.com/proxy/bh-Ls1uDEG6IwKwCq3DR9R1cNSampcXkpRSsXOZ76uz-cDCkdFJl6mhIDVEQtlWNagWVsq1ere-yRaWMKPKYKVM97JtiqBP9jsy37hp5Oq1J62K_IE84eriMmOHJVs12OM6ZXE-GA-E02OnoMKPpKCLKYnRHEV0=w252-h167-k-no; http://lh5.googleusercontent.com/p/AF1QipNl_UdnryQwhOTqts5pRPJCUVThbrqT5UtUyJ27=w252-h168-k-no; http://lh3.googleusercontent.com/proxy/l7juW8kbbsoemqTnkvu6BYgSO8dAp-6_gXpOLKnWlDpZ3dyYiK-RC0CNM3DCqVb9Fj8mASJRm5hP2FFVVvQMrqnrnEAfzQi-YL-HpnmO5KjkFntlE5JYjaYFRenfqwv4qIWt_iZXVgJgLwrboIMC9NBCUjhjXQ=w252-h168-k-no; http://lh5.googleusercontent.com/p/AF1QipPVNfx1p_lGzWGIR6A2cVKvoDReG6l_jbYhtf0H=s367-w367-h248-n-k-no; http://lh5.googleusercontent.com/p/AF1QipPZY3GNau_DpxpmFy1zI6Yz_NwiKA4KaiLLAnxs=s367-w367-h248-n-k-no; http://lh5.googleusercontent.com/p/AF1QipN8mZzKskkoA_Zbp9QVnvDBclg_KXOL3kzfqMGN=s367-w367-h248-n-k-no; http://lh5.googleusercontent.com/p/AF1QipPmh9bCncZkb_w5MqzQb6VbuJdQrmZDCbU6ZWeK=s367-w367-h248-n-k-no; http://lh5.googleusercontent.com/p/AF1QipP_7u3gxp5iarIvHbcN5dXfP6pzl5UeWRIzRcAA=s367-w367-h248-n-k-no
