hotel_id,rating,reviews_count,location,contact,category,amenities,coordinates,thumbnails
ChIJp2Td_afoaC4RcPLWwn97umQ,"4,6","8,6 rb","HARRIS Hotel & Conventions Festival Citylink, Jl. Peta No.241, Suka Asih, Bojongloa Kaler, Bandung City, West Java 40323",(022)6128600,Hotel bintang 4,"Kolam renang: Kolam renang luar, Tak ada bak air panas; Internet: Wi-Fi, Wi-Fi di area publik; Layanan: Resepsionis, Penatu layanan lengkap; Anak: Cocok untuk anak; Parkir & transportasi: Tempat parkir, Jemputan bandara, Antar-jemput lokal; Aksesibilitas: Ramah difabel; Kamar: Ber-AC; Makanan & minuman: Restoran, Pesan tempat makan, Makan malam prasmanan, Room service, Sarapan, Sarapan prasmanan; Kesehatan: Gym, Spa; Hewan peliharaan: Hewan peliharaan tidak diizinkan; Efisiensi energi: Program konservasi energi, Sistem pemanas dan pendingin hemat energi, Pencahayaan hemat energi, Termostat hemat energi; Pengurangan sampah: Program daur ulang, Zat berbahaya ditangani dengan aman, Elektronik, baterai, dan bola lampu dibuang dengan aman, Botol perlengkapan mandi yang dapat diisi ulang, Pos pengisian ulang botol air, Tidak ada sedotan plastik sekali pakai; Konservasi air: Keran, toilet, dan shower hemat air, Program penggunaan ulang handuk dan linen; Pengambilan sumber daya yang berkelanjutan: Kebijakan pembelian yang bertanggung jawab, Makanan dan minuman dari bahan-bahan lokal, Sajian laut yang ditangkap mengikuti aturan; ","Lat: -6.929580800000001, Lng: 107.5865762",http://lh3.googleusercontent.com/proxy/h40BYO8OymdV5YedPScXX4JiXJ4RBj-VssaN23IeEm-z1KSNHkhdEQzkRC61KtVE3n70SvW-GSkigBK0ay1lX6i-gLAWGK4L9my00buVdrjZuUa_UyZDIn6Zy0PYiZMCnBOEmgsUxEAunhKN-c_uuhjgF1ZIfEE=w252-h168-k-no; http://lh6.googleusercontent.com/proxy/4Wf6bZ5BbGEX3blS9barj4yCExXKZTn1US4CnqZh8TJGk9jXqrjgdOT-JPhhdzc_hFa7MV7tEI9nHacGy2rVIsODmlQ913SBrYsta639jadJcPk-US_Cjp6iH11QiuyO9Q0TIK9g6p4W59yGNZ1WC3nzNnR5ew=w252-h167-k-no; http://lh3.googleusercontent.com/proxy/oNSvmy-dpin3abMUF5qA5GrkOEN3mDAqKZIRtAQfLAL5kmhJ_T2UEfxnBkYs0zlNbZ7Yzeh_JXi7KOO9PItDLKNSSTrd7Ra7ZnncDtmmBGw3im-RZgYPUUvEckIex2qG8u7bo0YyEcEb7azjB-Tb70pDdc5mNDQ=w252-h159-k-no; http://lh5.googleusercontent.com/p/AF1QipPLIy6ulmQap6QC2496j34HX3kf-v9EWDkJ5HqZ=s367-w367-h248-n-k-no; http://lh5.googleusercontent.com/p/AF1QipN40iAUrl9i6t7yBKzsv1aGLg2xhm13DB-Vy1ol=s367-w367-h248-n-k-no; http://lh5.googleusercontent.com/p/AF1QipMTB3aK3wWsEhZ5OqOaLjOyDJpuzLa-SkxVH253=s367-w367-h248-n-k-no; http://lh5.googleusercontent.com/p/AF1QipMBZ1faqOWjmBH3_SP4_kFCRCpQTADGqIAKH__X=s367-w367-h248-n-k-no; http://lh5.googleusercontent.com/p/AF1QipPJqWmkDSQqlf4gFsDBlmw0K_tDN8EIIRQyezZU=s367-w367-h248-n-k-no; http://lh5.googleusercontent.com/p/AF1QipMOL5B2jKuQNwYYk15rV5xMvDzm-2BJWOfquswZ=s367-w367-h248-n-k-no; http://lh5.googleusercontent.com/p/AF1QipOx1BV_Rmzew3WIP2E7gGRC613p3d2o62jvWyUZ=s367-w367-h248-n-k-no; http://lh5.googleusercontent.com/p/AF1QipO_KlL6oDe-Dql2hvLgFH2HR0GTzFHcD7MmG1F1=s367-w367-h248-n-k-no; http://lh5.googleusercontent.com/p/AF1QipPHXooj3T0bJNHGKkdcAaWOcf--PfoopyLwDEUE=s367-w367-h248-n-k-no; http://lh5.googleusercontent.com/p/AF1QipPe11zgEiARE21N4sXxu06UJIJ7Jvvnj4JSbv3g=s367-w367-h248-n-k-no; http://lh5.googleusercontent.com/p/AF1QipMpGivfwqHrIU8jmAWsz5r8pOffZe6A6UIOplwt=s367-w367-h248-n-k-no; http://lh5.googleusercontent.com/p/AF1QipNp-wVWTazqDZ9e4NfiHybO91hUUDYZ7ENGbt5K=s367-w367-h248-n-k-no; http://lh5.googleusercontent.com/p/AF1QipMuDqUr0lsLBtbi_KC0fhC1MvdsESU9ZlQe1P2E=s367-w367-h248-n-k-no; http://lh5.googleusercontent.com/p/AF1QipO2uCIuVku97S14xt0mbHPOVBYLbfCy1lmj_ZOC=s367-w367-h248-n-k-no
ChIJK45W6WTmaC4RqNfA0IOO48Q,"4,2","3,5 rb","Jl. Dr. Djundjunan No.154, Sukagalih, Kec. Sukajadi, Kota Bandung, Jawa Barat 40163",(022)87775061,Hotel bintang 3,"Internet: Wi-Fi; Layanan: Resepsionis, Penatu layanan lengkap; Kolam renang: Tidak menyediakan kolam renang, Tak ada bak air panas; Kesehatan: Tidak memiliki gym, Tidak menyediakan spa; Hewan peliharaan: Hewan peliharaan tidak diizinkan; Makanan & minuman: Restoran, Room service, Sarapan, Sarapan prasmanan; Anak: Cocok untuk anak; Parkir & transportasi: Tempat parkir, Jemputan bandara; Aksesibilitas: Ramah difabel; Kamar: Ber-AC; ","Lat: -6.8920637, Lng: 107.5822168",http://lh5.googleusercontent.com/p/AF1QipOYB_gka777snimpTzpyn6v0qgAAblTK8-KkiGk=w252-h277-k-no; http://lh5.googleusercontent.com/p/AF1QipN3OXct-o-E41YjU6tpCqgbQq4FZ8kUYelbnBBy=w252-h167-k-no; http://lh5.googleusercontent.com/p/AF1QipM2YZAs23_IvmsSAvEZrLJHabrNSGrm4j04Rp1J=w252-h168-k-no
ChIJw8-rN9XnaC4RKbh5T05uhBk,"4,4","3,9 rb","Jl. Halimun No.36, Malabar, Kec. Lengkong, Kota Bandung, Jawa Barat 40262",(022)7303344,Hotel bintang 3,"Internet: Wi-Fi; Kebijakan & pembayaran: Properti bebas rokok, Kartu kredit, Kartu debit, Tunai; Layanan: Resepsionis, Penyimpanan bagasi, Concierge, Penatu layanan lengkap, Tata graha; Parkir & transportasi: Tempat parkir; Kesehatan: Tidak memiliki gym, Tidak menyediakan spa; Hewan peliharaan: Hewan peliharaan tidak diizinkan; Kamar mandi: Kamar mandi pribadi; Makanan & minuman: Restoran, Bar, Pesan tempat makan, Room service, Sarapan, Sarapan prasmanan; Aktivitas: Penyewaan sepeda; Anak: Cocok untuk anak, Aktivitas untuk anak; Kolam renang: Tidak menyediakan kolam renang, Tak ada bak air panas; Aksesibilitas: Ramah difabel; Bisnis & acara: Ruang rapat; Kamar: Ber-AC, Lemari es di beberapa kamar, Minibar di beberapa kamar; ","Lat: -6.9270799, Lng: 107.6232181",http://lh5.googleusercontent.com/p/AF1QipMMGDcuUXPG-h1kzQZPMbYG85MOUH88gfvm6B1Y=w252-h168-k-no; http://lh5.googleusercontent.com/p/AF1QipMAqC3wFl0Wqsz_AC2mZzHiKBs9zaHw_UAfeUuh=w252-h166-k-no; http://lh5.googleusercontent.com/p/AF1QipO2ymWEZ3UHvG1DzZkFM7EgFMCoLMmGjvPMCGn-=w252-h168-k-no; http://lh5.googleusercontent.com/p/AF1QipPfieKueZBP4PbzIUYJJgJR4HDeIPo2xtB-PD8F=s367-w367-h248-n-k-no; http://lh3.googleusercontent.com/gps-cs-s/AB5caB-BqSfD1AKJnO8mjW4cjtXJ8kuiWqK4cKt-LLsFEWUvLO9enoulNGTMjAykTiomcAKLSZwoxm5Noh2qJNa8d18PSNPMZI79dakderYKRv9y6QerQkeZ-n95wb_K_YXVPjOn2pHrvw=s367-w367-h248-n-k-no; http://lh3.googleusercontent.com/gps-cs-s/AB5caB9IELWSJuWK3ftYl8HE9xHopYUCmbhGwJk2pgKFDQnK6mP53e5RN0gFiJ7nZMovn-hyDnJWFRzfn_TfJr64GuhBABEUFhqLOeqFA-KozRA0FgXGo63xAk2gBWMAFzx0Uaofk-zd-Q=s367-w367-h248-n-k-no; http://lh3.googleusercontent.com/gps-cs-s/AB5caB_FSD4p2nm5nXHBEYuX758hn1RAMD63oWl12vZW1DqZ8Fu0Zqc8y8sO0P6e5BqBPUxCGKLnNXaxU_p32z6M541lZjhZEV6emObwbpnHaQGH2dGBPoWR844qgY1E_0IGHXjk8D5a2g=s367-w367-h248-n-k-no; http://lh3.googleusercontent.com/gps-cs-s/AB5caB8bl_W47_RTZw-CRJOpikgFquEK-jljDXEm8-2XCKs36iLF9gX-R8X-nEa_ltRzZZHpp1259HQZqWSJMulJ0lZcHzp-YsRQXlK8EBdGi1VJ3XST84JsOiJaOuDPJdL-D2-dH9-k=s367-w367-h248-n-k-no; http://lh3.googleusercontent.com/gps-cs-s/AB5caB8EsXM0E4Epav8XyEsMBDUdedNeh8LcIhcibJ7hTqFGAy_fvvjpHFf7J5vlRFaFzo2_jm-TWTUQL3W-KNlddZVNYq9ayKWjSYMRwAw0okBIMdzWK-Q912OniNN_bROAndngy0Ed=s367-w367-h248-n-k-no; http://lh3.googleusercontent.com/gps-cs-s/AB5caB8e91rxLmgN9jgz6Mh5FaxGJnFyBjVJ_pW7GiKTv_zo0aFfia6E_C42GdX4SWCsZ24gtoPNt9MUqeKFRL9rQ99Y4ZO4CaOjsxL8t-O6iWBwcDrzI8QBg_FRebiHvdYsU_wYW3yWMw=s367-w367-h248-n-k-no; http://lh3.googleusercontent.com/gps-cs-s/AB5caB8nlGzdQ9oF9hxhxHV3vjMhRjSwzo926AtBYYS1Zd92zTC5vFVy4TpEgdyWNhYRRH2kn6K75lVZVw55_u8mlQ5vwojT1Ft3B2L3tPS06oOK8-x0PA48avwh882BcQY_a40HwOCM=s367-w367-h248-n-k-no; http://lh3.googleusercontent.com/gps-cs-s/AB5caB9cd2it70RwaoLkrKqxlAg0OZFHt6OY1U4DbT3NS-io5XwV0A6bZZ8lD0Li-oJ4wCAm6UXLzIdIJ6CIRKEgdBCtTxYquawZsNocrr-zWI_azp5Rt01mk0Vf4yaBpps42uZsrChHPw=s367-w367-h248-n-k-no; http://lh3.googleusercontent.com/gps-cs-s/AB5caB8VE3euB4DDPjbfioVhogwUnyz4DoyJO29BFDIyAFHkJRRRtZWKUqgeWcDxmrfgMc_P-he3n5wfeyCtOFaflxFT--bwUS-2u0tpBHEgx4teof1y2Jz8RYNBdlWqa4c1Ovt-6S3PVw=s367-w367-h248-n-k-no
ChIJ3VAjcETmaC4RxcUT1_L8uqE,"4,5","4,9 rb","Jl. Cihampelas No.80-82, Tamansari, Kec. Bandung Wetan, Kota Bandung, Jawa Barat 40116",(022)42690111,Hotel bintang 4,"Kolam renang: Kolam renang luar, Kolam berendam, Tak ada bak air panas; Internet: Wi-Fi; Layanan: Resepsionis, Penatu layanan lengkap; Kesehatan: Gym, Spa; Kamar: Ber-AC; Makanan & minuman: Restoran, Room service, Sarapan, Sarapan prasmanan; Anak: Cocok untuk anak; Parkir & transportasi: Tempat parkir; Aksesibilitas: Ramah difabel; Hewan peliharaan: Hewan peliharaan tidak diizinkan; ","Lat: -6.9010206, Lng: 107.6046142",http://lh3.googleusercontent.com/p/AF1QipOdhZ5S7GqUkSxIeIjx3O_QYYLll-N8_MCpH8Kh=w252-h252-k-no; http://lh6.googleusercontent.com/proxy/ijh0zEQccrlRJ_apGE5qcdTENCknARPIaDf6XWckVxXlqJtGJJ_b6VBEOZadU1uxaEGv71QvyPnC2zeDVpNwUwf4ssiD2e_dIT9sl0eH22dD5DO_PIzcRXr3amQgOuMd6W2XYQnPGwu4gQGPdWNw-5Vhhw2svK0=w252-h168-k-no; http://lh6.googleusercontent.com/proxy/haEDdA3nD66wOsJf6kAjIptFmZJt28sPE-auaKAPlPK-9NCloBYhyyu6uoxSkHubhQovzdzcRpZQSe0ZMKGnI3nLQQG-HBdVDb78C4ToFBUDZxU9uOMmEvmMbl5yScNQdDNRlMEQC65KOeKE1F7zgnhqZTtSqQ=w252-h167-k-no
ChIJQY_5_ZnmaC4RQ9gxt9M3nF8,"4,3","2,7 rb","Jl. Setrasari Raya No.10, Sukarasa, Kec. Sukasari, Kota Bandung, Jawa Barat 40152",(022)2011100,Hotel bintang 3,"Kolam renang: Kolam renang luar, Tak ada bak air panas; Internet: Wi-Fi; Kebijakan & pembayaran: Kartu kredit, Kartu debit, Pembayaran seluler via NFC, Tunai; Anak: Cocok untuk anak; Parkir & transportasi: Tempat parkir, Jemputan bandara; Aksesibilitas: Tidak dapat diakses; Kamar: Ber-AC; Makanan & minuman: Restoran, Room service, Sarapan, Sarapan prasmanan; Layanan: Resepsionis, Penatu layanan lengkap; Kesehatan: Tidak memiliki gym, Tidak menyediakan spa; Hewan peliharaan: Hewan peliharaan tidak diizinkan; Efisiensi energi: Program konservasi energi, Sistem pemanas dan pendingin hemat energi, Pencahayaan hemat energi; Pengurangan sampah: Kelebihan makanan dikompos, Elektronik, baterai, dan bola lampu dibuang dengan aman, Pos pengisian ulang botol air; Konservasi air: Keran, toilet, dan shower hemat air, Program penggunaan ulang handuk dan linen; ","Lat: -6.870561599999999, Lng: 107.5863565",http://lh5.googleusercontent.com/p/AF1QipMqLUFKbsgfYrke9ELnRjBCe9zagUhn_h50tYfN=w252-h157-k-no; http://lh5.googleusercontent.com/p/AF1QipNYvYQQer_dBjcuCYzG89ftE477SDG7aUQr4FAJ=w252-h168-k-no; http://lh5.googleusercontent.com/p/AF1QipPbc6sXQTzyDEY3IWxpCYCyQiPXYSAhxYtOcG-x=w252-h168-k-no; http://lh5.googleusercontent.com/p/AF1QipNs-gBUH2gqC-joSKO9rgaqmKU0vVh8YwM1Zqyl=s367-w367-h248-n-k-no; http://lh5.googleusercontent.com/p/AF1QipO643cnUgHaPOS9kQjGwWufutaC05P3mMtF_MGg=s367-w367-h248-n-k-no; http://lh5.googleusercontent.com/p/AF1QipNqWqnEoXSKtnk3VDhTYe7rP_jPyYC7z_pC8fUz=s367-w367-h248-n-k-no; http://lh5.googleusercontent.com/p/AF1QipMZOTUV7BhHngWCPFFtoB2-A120oZn4qbFN6D9b=s367-w367-h248-n-k-no; http://lh5.googleusercontent.com/p/AF1QipNibMy6nARPU9YAi1t5_wRs64l-L4WE_2RtXRHS=s367-w367-h248-n-k-no; http://lh5.googleusercontent.com/p/AF1QipPUsqAI32pxZXdhtwPokM2WxpGec9xmvdOc685W=s367-w367-h248-n-k-no; http://lh5.googleusercontent.com/p/AF1QipNzQCc0XHgTcwhXhzBK_sBVzVFipq4h0Suwkg0a=s367-w367-h248-n-k-no; http://lh5.googleusercontent.com/p/AF1QipO03-BNROySO7MZvmZShFIEP-zFMO07Qwi-QmpY=s367-w367-h248-n-k-no; http://lh5.googleusercontent.com/p/AF1QipPwY3jZlQ-qwSiWNMT2mwqbQ892A2ETJcR_KIn6=s367-w367-h248-n-k-no; http://lh5.googleusercontent.com/p/AF1QipNGQ87-XSd7zRW6CeDA6w1ZnTIPciw2Pc1K4szX=s367-w367-h248-n-k-no; http://lh5.googleusercontent.com/p/AF1QipNF1EJwo2Frv42gUgd8ArkMfKSJJr8uyihJEW1t=s367-w367-h248-n-k-no; http://lh5.googleusercontent.com/p/AF1QipMJ1MyBHkkaScobqWnQ9WmIzdU46wdBLNBAw3Mh=s367-w367-h248-n-k-no; http://lh5.googleusercontent.com/p/AF1QipOKDXz4wwA_d0vG7pYxqEMgtkf9epNclN9isE8K=s367-w367-h248-n-k-no; http://lh5.googleusercontent.com/p/AF1QipPc4bTlFy8gRtwqVti530HV_pyr0Ui_w8ikMb6E=s367-w367-h248-n-k-no; http://lh5.googleusercontent.com/p/AF1QipPdYG0P_lQU1059JrFcrb5edlVsX6Ehk7c_WaBF=s367-w367-h248-n-k-no; http://lh5.googleusercontent.com/p/AF1QipMbhxAjCwMqGXGw-VAfP5BbbqP-PhxfS_ajJH4o=s367-w367-h248-n-k-no?w=1024
ChIJY9Iv_7DnaC4R4Vj9ryRFecU,"4,3","1,2 rb","Jl. Surapati No.51, Sadang Serang, Kecamatan Coblong, Kota Bandung, Jawa Barat 40133",(022)2511718,Hotel bintang 2,"Internet: Wi-Fi; Layanan: Resepsionis, Penatu layanan lengkap; Kolam renang: Tidak menyediakan kolam renang, Tak ada bak air panas; Kesehatan: Tidak memiliki gym, Tidak menyediakan spa; Kamar: Ber-AC; Makanan & minuman: Restoran, Room service, Sarapan, Sarapan prasmanan; Anak: Cocok untuk anak; Parkir & transportasi: Tempat parkir; Hewan peliharaan: Hewan peliharaan tidak diizinkan; ","Lat: -6.899056099999999, Lng: 107.6196941",http://lh6.googleusercontent.com/proxy/5708pd9NpRIcXsa05LBe0rtXYjG9OP3asl5AqwC1xtonP7Nplb9pRlLeKEhPvmD_5JpevYRRHXzZWKo7xLrc8fLTPbsr3mFhI4LvtYMOag319eg_PXb-6zUhogC4-YRGiSylJBKrlXFDzso6S2SRF6VyC-yqghrWYal9=w252-h189-k-no; http://lh6.googleusercontent.com/proxy/6Z0tYZsCNcXAwSEtCVJb2q0HFw0JXPYL3ZIMagUPzI14GDygTdljDeBqsHc-wUQucLGdTITWJatQpCa9yYxKiuXlTk0iqdiooTbtHDBSnw_GDtJjUvSLbk1XypQ9niX-Le0BzJi92c-8hPp3nZSbLbezb6V-VA=w252-h168-k-no; http://lh5.googleusercontent.com/proxy/jhrtjRmsB7M_0tcwD7s-WkYQT4AwPAS8v-MzhYF5mdJ7LzIciA3Fs5lkXHyeflHe3Si-9ObC9ig8DhH1hQQ24eq1gGZMCjSpNCATIWwe1ecQR8xCqKrN2ibfv-GvLqbYckjGRZNHpdgghQ3n4Bs5q2kfk5GM5GQ=w252-h189-k-no
ChIJYecPEpPmaC4RclO1lIxV9AU,"4,4","2,7 rb","Jl. Dr. Setiabudi No.156A, Hegarmanah, Kec. Cidadap, Kota Bandung, Jawa Barat 40141",(022)82602090,Hotel bintang 2,"Internet: Wi-Fi; Layanan: Resepsionis; Anak: Cocok untuk anak; Parkir & transportasi: Tempat parkir; Aksesibilitas: Ramah difabel; Kamar: Ber-AC; Makanan & minuman: Restoran, Room service, Sarapan, Sarapan prasmanan; Kolam renang: Tidak menyediakan kolam renang, Tak ada bak air panas; Kesehatan: Tidak memiliki gym, Tidak menyediakan spa; Hewan peliharaan: Hewan peliharaan tidak diizinkan; ","Lat: -6.873511, Lng: 107.5958698",http://lh5.googleusercontent.com/p/AF1QipPLWKnjYUxcMxZimy5smJW9CDndemIJN6Y30RRb=w252-h390-k-no; http://lh3.googleusercontent.com/proxy/lK4VXpGPwNW-Rp2LGHrD0f_Ll4-gojx75lj8gB1rhvcYj5U-l7oA7httyOnUatwQAYOUWUkOAew-7WgJJs5Lnz4WJZu3bqJYJU2Wp1owXVvFYiEhBmUGm4zgx_PowdnYH9tmUUHKvegPfY_UpTzrLAwwW-HCcw=w252-h168-k-no; http://lh5.googleusercontent.com/p/AF1QipPs7L9qBf2rO3ZU0YKVMY8je6q0_hDhnwDUn5O_=w252-h178-k-no
ChIJ91rS-PHmaC4RgvYetTvngWc,"4,1","1,4 rb","Tower Parahyangan Residences, Jl. Ciumbuleuit No.125 Complex LG, Hegarmanah, Kec. Cidadap, Kota Bandung, Jawa Barat 40141",(022)82602600,Hotel bintang 3,"Kolam renang: Kolam renang luar, Tak ada bak air panas; Internet: Wi-Fi; Kebijakan & pembayaran: Kartu kredit, Kartu debit, Tunai; Anak: Cocok untuk anak; Parkir & transportasi: Tempat parkir, Antar jemput bandara; Aksesibilitas: Ramah difabel, Fasilitas parkir difabel, Lift bagi difabel, Fasilitas kolam renang difabel; Hewan peliharaan: Hewan peliharaan tidak diizinkan; Kamar: Ber-AC, Lemari es; Makanan & minuman: Restoran, Room service, Tanpa sarapan, Mesin penjual otomatis; Layanan: Resepsionis, Penatu layanan lengkap; Kesehatan: Gym, Mesin eliptik, Treadmill, Mesin beban, Angkat beban, Tidak menyediakan spa; Bahasa yang digunakan: Inggris, Indonesia; Kamar mandi: Kamar mandi pribadi, Pancuran; ","Lat: -6.8770538, Lng: 107.6032006",http://lh5.googleusercontent.com/p/AF1QipNflOUfFwE5MCtZ0GRXnB09Hp7b1fMGhzNHffY=w252-h189-k-no; http://lh3.googleusercontent.com/gvs/AG4uZQlV72KHCKtd6jxBLUdIaZKUL0437U3rMWkR5_pHrA27DO_NBEerhpowTsGHRYtY7aux0zBHEZmCZn-Q-_uzSOkL9c90mOgqclE; http://lh3.googleusercontent.com/gvs/AG4uZQkXvbp-LCZuYSyH_s_S_b2_qpnnavKaR1UHQ1mTh7fZGFvRxmTjrU9fm1T1LH_Z9c5EzCOU3k3cQ39Ez3ZGMk0mfrQjm7ym9T8
ChIJX6TsWOLmaC4RHYoVrUvrfPo,"4,3","1,1 rb","Jl. Ir. H. Juanda No.392 - 394, Dago, Kecamatan Coblong, Kota Bandung, Jawa Barat 40135",(022)2536677,Hotel bintang 3,"Kolam renang: Kolam renang luar, Tak ada bak air panas; Internet: Wi-Fi; Layanan: Resepsionis, Penatu layanan lengkap; Kesehatan: Tidak memiliki gym, Spa; Kamar: Ber-AC, Minibar; Makanan & minuman: Restoran, Room service, Sarapan, Sarapan prasmanan; Anak: Cocok untuk anak; Parkir & transportasi: Tempat parkir, Jemputan bandara; Hewan peliharaan: Hewan peliharaan tidak diizinkan; ","Lat: -6.873735099999999, Lng: 107.6195227",http://lh5.googleusercontent.com/p/AF1QipNLm8Ge5yVS8XkxOclpM_Cg7Li8CbyEa7_oDsL-=w252-h159-k-no; http://lh5.googleusercontent.com/proxy/OXtD9kXv5BZmuXMhjE8qVrQhD5P5NAJ0DMErxHWcWrofIlAgmJXAlROGMsAWqelawDBqICurili5Ar0zUQOISNIqXck1chkTf909zM4V2RJv8dgo142yHitIYHIPs_rbpvye-rCGkRB04pCbNv-Z_a_4LnCyZg=w252-h167-k-no; http://lh6.googleusercontent.com/proxy/981X6EhUSWR483Q9P7Fp2091ulh7V3tUhzVXQgBaJ-8C3HjB6Cxle0LyJ6lo6UswUUAOnzhE0t6PMH8QHfBAPZMcpkIJJkplOprXzAATE7K9WC3qqMWCgFPJHV7w-OIIeNyB6kRS29qKRhH3nos2XVpzFwcAPQ=w252-h167-k-no
ChIJ687ZnVzmaC4RkgDKUTzCqPw,"4,5","7,3 rb","Jl. Cihampelas No.129, Cipaganti, Kecamatan Coblong, Kota Bandung, Jawa Barat 40131",(022)2030300,Hotel bintang 3,"Kolam renang: Kolam renang luar, Tak ada bak air panas; Internet: Wi-Fi; Layanan: Resepsionis, Penatu layanan lengkap; Kesehatan: Gym, Spa; Hewan peliharaan: Hewan peliharaan tidak diizinkan; Makanan & minuman: Restoran, Room service, Sarapan, Sarapan prasmanan; Anak: Cocok untuk anak; Parkir & transportasi: Tempat parkir, Jemputan bandara; Aksesibilitas: Ramah difabel; Kamar: Ber-AC; ","Lat: -6.896211099999999, Lng: 107.6034164",http://lh5.googleusercontent.com/p/AF1QipOUXc8AKBcA6AGD_OlhlQPZuHyPc2wWWOPa2LAN=w252-h168-k-no; http://lh3.googleusercontent.com/proxy/eAfeFuHQCl_H3F-F3FYtPpzentbifcAgaAvgNMfaT9lQYQS2xsu9MU46c9Mh1cmaLRcjYT5zT4tFPvWmWVX6Pc_Gico67kHz3bUtbkfjaadlTL7ocKR2A_ecoKgr7INuDAEBkK-AedjIcpPOYM0P4_Nu0VLZ7z0=w252-h146-k-no; http://lh3.googleusercontent.com/proxy/O-tBRpHIN_ggENhXz-bJ41ZZg-HyFnDf-79gcAFfImD5OWkLy9cZUJIME3SvrTzMWMhiVK1LRy_XDuXrVMbhbyOtlbRG4Bnhv377Jn6ZDd3rDpb8NiA8JhsPhD4P5muIO_LEQOxb9aMLNikKdPb6BSo-Fo9OInw=w252-h146-k-no; http://lh5.googleusercontent.com/p/AF1QipNJI8-XD2geMvJaZC_SwmIVj6yMNwFc9AB0Ms0d=s367-w367-h248-n-k-no; http://lh5.googleusercontent.com/p/AF1QipNnebG_9oLYpk1g0b_0XFe9EiL8U55hzKdsQNcK=s367-w367-h248-n-k-no; http://lh5.googleusercontent.com/p/AF1QipObn8UXP91uV3D5RTDWmaOglRLcMOprZsqPgkyG=s367-w367-h248-n-k-no; http://lh5.googleusercontent.com/p/AF1QipOl4m0yVCcPWbbhakSF92S45U7z1dsyT0rBiqqU=s367-w367-h248-n-k-no; http://lh5.googleusercontent.com/p/AF1QipNMfpnJbZGYHtB1hhalk0NC7xUy33Cy1tuG1Id4=s367-w367-h248-n-k-no
ChIJF230yyvpaC4RNBlVtHPdHfA,"4,7","2,1 rb","Jl. Peta No.176, Suka Asih, Kec. Bojongloa Kaler, Kota Bandung, Jawa Barat 40231",(022)20566666,Hotel bintang 3,"Kolam renang: Kolam renang luar, Kolam berendam, Tak ada bak air panas; Internet: Wi-Fi; Layanan: Resepsionis, Penatu layanan lengkap; Hewan peliharaan: Hewan peliharaan tidak diizinkan; Kamar: Ber-AC; Makanan & minuman: Restoran, Makan malam prasmanan, Room service, Sarapan, Sarapan prasmanan; Parkir & transportasi: Tempat parkir, Jemputan bandara; Kesehatan: Tidak memiliki gym, Tidak menyediakan spa; ","Lat: -6.9329462, Lng: 107.5905024",http://lh5.googleusercontent.com/p/AF1QipPF2vt0ZctiJuHLI8RVnPDP41B433s1IbxdqfhD=w252-h189-k-no; http://lh5.googleusercontent.com/p/AF1QipNH4dNy4_VteKhV5mBP5_XyCbZW3eJ2nOAquJKu=w252-h168-k-no; http://lh5.googleusercontent.com/p/AF1QipOLEwxr9I88o1cM5IBAeFdJxXkmKZQOuGPh2lha=w252-h168-k-no
ChIJe6vpRKHnaC4RVC8ZRbOyQmY,"4,7","2,0 rb","Jl. Braga No.99-101, Braga, Kec. Sumur Bandung, Kota Bandung, Jawa Barat 40111",(022)84460000,Hotel bintang 4,"Kolam renang: Kolam renang luar, Kolam renang khusus dewasa, Tak ada bak air panas; Internet: Wi-Fi, Wi-Fi di area publik, Tempat kerja dengan internet publik; Kebijakan & pembayaran: Kartu kredit, Kartu debit, Tunai; Parkir & transportasi: Tempat parkir, Jemputan bandara; Aksesibilitas: Tidak dapat diakses; Bisnis & acara: Business center, Ruang rapat; Hewan peliharaan: Hewan peliharaan tidak diizinkan; Kamar: Ber-AC; Makanan & minuman: Restoran, Bar, Pesan tempat makan, Room service, Sarapan, Sarapan prasmanan; Layanan: Resepsionis, Penyimpanan bagasi, Concierge, Minimarket, Penatu layanan lengkap, Layanan membangunkan, Toko suvenir, Tata graha; Kesehatan: Gym, Treadmill, Mesin beban, Angkat beban, Tidak menyediakan spa, Dokter panggilan; Bahasa yang digunakan: Inggris, Indonesia; ","Lat: -6.9169392, Lng: 107.6086352",http://lh5.googleusercontent.com/p/AF1QipOZjAGyksP37daB80Vfb-XMVGNhkUJY0SQ3jrWb=w252-h168-k-no; http://lh5.googleusercontent.com/p/AF1QipNZjWI8uFHntBnCftQfoAbWsBnYsuAMfWo1iMji=w252-h168-k-no; http://lh5.googleusercontent.com/p/AF1QipP-SMQafcI1PWGXxg4LqT4Ef1MARyC4BQL13UqX=w252-h168-k-no
ChIJlzm_GlrnaC4RmkewmcP9zC8,"4,7",599,"Jl. Pasir Kaliki No.78, Pasir Kaliki, Kec. Cicendo, Kota Bandung, Jawa Barat 40171",(022)4266466,Hotel bintang 3,"Internet: Wi-Fi; Layanan: Resepsionis, Penatu layanan lengkap; Parkir & transportasi: Tempat parkir; Kesehatan: Tidak memiliki gym; Makanan & minuman: Restoran, Room service, Sarapan, Sarapan prasmanan; Kolam renang: Tidak menyediakan kolam renang, Tak ada bak air panas; Kamar: Ber-AC; ","Lat: -6.910193400000001, Lng: 107.5981814",http://lh3.googleusercontent.com/p/AF1QipP7C0OVtL-VfzAll6_v1nfFvVCwBoJVfgvE6nBI=w252-h448-k-no; http://lh5.googleusercontent.com/p/AF1QipP5v8qqbj9Xx53zYQxnY07fxZ701Rtgq1THPhnZ=w252-h168-k-no; http://lh5.googleusercontent.com/p/AF1QipM0rzwyWx1wtIPJZ1Adhp2h9WrxmCT4FWfbg-ZV=w252-h189-k-no
ChIJx3Xs_YzoaC4RtYq4yPwjGcw,"4,3",699,"Ciseureuh, Kec. Regol, Kota Bandung, Jawa Barat 40255",(022)5201007,Hotel bintang 3,"Internet: Wi-Fi; Layanan: Resepsionis; Kolam renang: Tidak menyediakan kolam renang, Tak ada bak air panas; Kesehatan: Tidak memiliki gym, Tidak menyediakan spa; Makanan & minuman: Restoran, Room service; Anak: Cocok untuk anak; Parkir & transportasi: Tempat parkir; Hewan peliharaan: Hewan peliharaan tidak diizinkan; Kamar: Ber-AC; ","Lat: -6.9464194, Lng: 107.6127031",http://lh4.googleusercontent.com/proxy/m3TXKEoav-Ht_5bw8ExJCYEwTFYGOA-lq221J9wbQ8l8rG8q9VepV0TVNAPu0UH7xcmn5VQzGRs0gOQwe_wcszO5XDiSj8u-klP0mMv8Z5Gck52MEUg6RL2tEpCDONocFiUl2hEnAZjkTPJahsFbIioV9Dy1AA=w252-h188-k-no; http://lh3.googleusercontent.com/proxy/6VPasBTfvhBtt2G1DTSHEIz0lFt-pb3-z4TBNKZupDMA0AJFCBWSnuxzGE0hTe4ppbf5P5CaHKWCXbe6qw_gjBLFgzb0VUblIcnsn-Z_yb5MCrqr8cSkEFMoE6-bfWJGZjAlX-qJ0c9S4xhTzhvUFftXd_HWOmc=w252-h188-k-no; http://lh4.googleusercontent.com/proxy/dFHa7kgvAC1DvjORPHLSUzPj_Uwo7nioG0Y1pGjrAneMDVpSp1ilUqNwJVe-UIAIWtRTt3aWqEp7QHR6i-OvS7d7yRQWcaez7ZXbEau9AIQXqbmvuhmUegO9hs5BG-mxqE8lG1Nz9CF_8oWjanyGJcZAuatzvw=w252-h188-k-no; http://lh3.googleusercontent.com/gps-cs-s/AB5caB8sekx4re3ARFH4tvdSA6CN5-gvyTIsRFGo63FLu70ZhdTyKBbPU16YD8AKVcmNUlYhpv2-1PvEWfMnvIPd8u17b_1QX1xNEFVprTtsgJTXWEHGjd1ETZWjD5JvGumSCYFDf1g=s367-w367-h248-n-k-no; http://lh3.googleusercontent.com/gps-cs-s/AB5caB8rhYNQJ9HwwDwGxIdmkckzVee0lP8BSHNPuO6Uco3G8526vFrm1Y15TeF_aQlYSf7pkJDZ8WsSSpOJJfdEMqGg1IGRzrlyiZKPdsq1oRuGkDsuOsPfvYH38TelpcFPkxPqKAp6=s367-w367-h248-n-k-no; http://lh3.googleusercontent.com/gps-cs-s/AB5caB9habGnHy3iPAa3UpPoUVjyLeozqhOu9GK4elxy99C38OyzuLRlE0I0rbGl1LJUegoF2tZ4YClms-eTKqCo8gQ04UTsBheLXRITm9KIi8OzcJP7xydMSw1-p98HWPBD4nLlDF0C=s367-w367-h248-n-k-no
ChIJnfvQeGzoaC4Rems0KfzuNWU,"4,2","1,8 rb","Jl. Ibrahim Adjie No.414, Binong, Kec. Batununggal, Kota Bandung, Jawa Barat 40275",(022)7333220,Hotel bintang 3,"Internet: Wi-Fi; Layanan: Resepsionis, Penatu layanan lengkap; Kolam renang: Tidak menyediakan kolam renang, Tak ada bak air panas; Kesehatan: Tidak memiliki gym, Tidak menyediakan spa; Kamar: Ber-AC; Makanan & minuman: Restoran, Room service, Sarapan, Sarapan prasmanan; Anak: Cocok untuk anak; Parkir & transportasi: Tempat parkir; Hewan peliharaan: Hewan peliharaan tidak diizinkan; ","Lat: -6.9422685, Lng: 107.6417816",http://lh5.googleusercontent.com/proxy/35F3bzqWUJXnebfngwtuJnymODpmPYownjNlMTl0cHjxJJbCpkV-CduQW27tFM6_EAjkQIB0VqdoJFuVAT850z67cp8VJZO7HtloCoe0MizcJJOfAm4zgElWpFHal9zLZiWDigDCAbpo1toiu7-ijb-HLkCafg=w252-h189-k-no; http://lh6.googleusercontent.com/proxy/izNEpws_mxIlWFCHdFJq92Dk_PDZtIu_hf0iVgVnMhwkrb5GRNo3mUSZLV8qNgREFMrHh77Gj_GQknjU40riMiIkX6_ehzhjZGDxzE6vkEAtSZL0zJJOMR2kcF2KU8dB8D3UThNpQxvfsaELMRWLOysYQ0b6TQ=w252-h167-k-no; http://lh5.googleusercontent.com/proxy/hqk_Cm0MUDmSMeJalIwhmGzdNdGdruldTKCgQI7zCMzXpnWHAGT6MVCDBD1pD_L9nkC8P1HzMtJI0F__3jVSScd0LNSsYbMIEe80l9rxvOgkXt5K2VkeWWoRYiC48QCMcMP25WaGliCFXtw2BNMu5QXq6CqmjcA=w252-h167-k-no
