hotel_id,rating,reviews_count,location,contact,category,amenities,coordinates,thumbnails
ChIJezIyTrznaC4R7DU7FhVXFTo,"4,5","4,8 rb","Jl. Penghulu Haji Hasan Mustofa No.47/57, Neglasari, Kec. Cibeunying Kaler, Kota Bandung, Jawa Barat 40124",(022)87772000,Hotel bintang 4,"Kolam renang: Kolam renang luar, Tak ada bak air panas; Internet: Wi-Fi; Layanan: Resepsionis, Penatu layanan lengkap; Anak: Cocok untuk anak; Parkir & transportasi: Tempat parkir, Jemputan bandara, Antar-jemput lokal; Hewan peliharaan: Hewan peliharaan tidak diizinkan; Makanan & minuman: Restoran, Bar, Room service, Sarapan, Sarapan prasmanan; Kesehatan: Gym, Spa; Kamar: Ber-AC; ","Lat: -6.899297600000001, Lng: 107.6415711",http://lh5.googleusercontent.com/p/AF1QipMz5f-hExwyvhdoVIaR8ICQd9teNw4BoqDTpRXL=w252-h142-k-no; http://lh4.googleusercontent.com/proxy/yMKXDjtlm0NFmywGzTMMfThZO2hogV1zbOj1wo4a5l6tMDUS-ztrf6obhJOJ6tBWvZnpEEFURZKxOzSuwKRA3D5Ny1iutDKTUCJsR6JRkJVEhd8pKsiOUXyI8r3bNz0bCyn0f8bdqFoRPFlElSYUFZU1hADeiw=w252-h189-k-no; http://lh4.googleusercontent.com/proxy/J4kvP7QMaB6EWOufM-SyzbFHth2KZWcH18Ch6mKDk8E_pF9SnYFSFy9x56rkOtjANz4SsrW0qic-iMR4mvnu_teUHoRy2Q7UtS4KGs7gFVHWWOLEBOzLeaNpA78hfYcLsz-_76Ls32tyff6ucIf0i9gaU1EC9n4=w252-h168-k-no; http://lh3.googleusercontent.com/gps-cs-s/AB5caB-B_nKSOZwSN28t4kl4MiaerIOS7NRlaF-Wdeqg0LqZZkos57YOOowUeg-QIj0KbA8G3Dj3BHKpyEpjzhH0M7j_sqR_jku5yCfnFsQwhEL2G9PjEesATTeQO0cEaE4Jf7IGFfhsQw=s367-w367-h248-n-k-no?w=1024
ChIJ820zlUbmaC4Rp4n3TeiKOdg,"4,5","3,0 rb","Jl. Wastukencana No.48, RT.01/RW.17, Tamansari, Kec. Bandung Wetan, Kota Bandung, Jawa Barat 40116",(022)4268588,Hotel bintang 3,"Internet: Wi-Fi, Wi-Fi di area publik, Tempat kerja dengan internet publik; Kebijakan & pembayaran: Kartu kredit, Kartu debit, Pembayaran seluler via NFC, Tunai; Anak: Cocok untuk anak; Kolam renang: Tidak menyediakan kolam renang, Tak ada bak air panas; Kesehatan: Tidak memiliki gym, Pijat, Tidak menyediakan spa; Kamar: Ber-AC, Mesin pembuat kopi, Minibar; Makanan & minuman: Restoran, Room service, Sarapan, Sarapan prasmanan; Layanan: Resepsionis, Penyimpanan bagasi, Concierge, Elevator, Layanan membangunkan, Toko suvenir; Parkir & transportasi: Tempat parkir, Parkir valet; Bisnis & acara: Ruang rapat; Hewan peliharaan: Hewan peliharaan tidak diizinkan; Kamar mandi: Pancuran; ","Lat: -6.903828499999999, Lng: 107.6052744",http://lh6.googleusercontent.com/proxy/zsO6crysTqovjDgyyt6WWMF26Y9NSG_KWSM_zOYA8lionU5ySdF4bY2ALM5UW6cENB2rnaCKT0Pai61QL3u00Y6NYt6xdyRQLabLnbSy0u73JBXqa8TRN1wHio4s_-BBTefbHLuZhS6CKLoxA1nPNvLoRh1R6Q=w252-h174-k-no; http://lh5.googleusercontent.com/p/AF1QipN4SXC5VzZeddOoM4xNoIxeIuqbQT-CZEOFPl4O=w252-h168-k-no; http://lh3.googleusercontent.com/proxy/p47ZrFPSjtfIJOkQaPHH97yzQ9u2rRrZU9-ZvjzAtZKFIWvf- wK2wkhRVCWUqaAa8YOMqjiVttNUPakKQ7wdzh7k2B1QjPXPicJwksN68CGhBKhkKGNAAmxK1bbOBs4dqV9GXHSTil2NrT35TkTmhXKybPx87g=w252-h174-k-no
ChIJuSia887naC4ReWNSnMDMBWQ,"4,6","1,8 rb","Jl. L. L. R.E. Martadinata No.160, Merdeka, Kec. Sumur Bandung, Kota Bandung, Jawa Barat 40113",(022)87243460,Hotel bintang 3,"Internet: Wi-Fi; Kebijakan & pembayaran: Kartu kredit, Kartu debit, Tunai; Layanan: Resepsionis, Concierge, Penatu layanan lengkap, Elevator, Layanan membangunkan, Toko suvenir; Parkir & transportasi: Tempat parkir; Aksesibilitas: Ramah difabel; Hewan peliharaan: Hewan peliharaan tidak diizinkan; Kamar: Ber-AC, Lemari es di beberapa kamar, Mesin pembuat kopi; Makanan & minuman: Restoran, Room service, Sarapan, Sarapan prasmanan; Aktivitas: Toko butik; Anak: Cocok untuk anak; Kolam renang: Tidak menyediakan kolam renang, Tak ada bak air panas; Kesehatan: Tidak memiliki gym; Bisnis & acara: Ruang rapat; Bahasa yang digunakan: Inggris, Indonesia; Kamar mandi: Kamar mandi pribadi, Pancuran; ","Lat: -6.914240899999999, Lng: 107.6291595",http://lh4.googleusercontent.com/proxy/Kpe4h7A9LkIMX-BBpSfogbukS4JBlKAKUewsue5dR3Ez1VCWhnaug0WiG27HMNeQ_Mp0_x36EO_b9ikqwjYqOTN5FiBqCwTGukGBGGkw3K8mL1mV7A4zlKUmSTqbGr1nqH7fo5uUQbwMhHN-DbwxjkxVsq1vNYE=w252-h179-k-no; http://lh5.googleusercontent.com/proxy/Z6ncn0HCfA0ZgyYZXm2HipgObLRlY35yLS6iCSfMthL4RxuEwvCNG2nOy-K3eT01aEWyKnPC0dEsNamEHociBx0QG0oh3ZH0nCfN6MhGPscKIgsggZOiaiWb3GgN_ClzukGEGKnNVbj8ppokkB2Jw-8hYMtJu0s=w252-h151-k-no; http://lh5.googleusercontent.com/p/AF1QipMQUKkbYhRs8LbUhXZo3F4aLjCrXMbrx5Va2fk4=w252-h168-k-no
ChIJmyeDt0rmaC4Rn66gB_GqpMs,"4,5","5,7 rb","Jalan Laks LLRE Martadinata St No.68, Citarum, Bandung Wetan, Bandung City, West Java 40115",(022)86012888,Hotel bintang 4,"Kolam renang: Kolam renang di dalam ruangan, Kolam renang luar, Tak ada bak air panas; Internet: Wi-Fi; Layanan: Resepsionis, Penatu layanan lengkap; Anak: Cocok untuk anak; Parkir & transportasi: Tempat parkir, Jemputan bandara; Aksesibilitas: Ramah difabel; Kamar: Ber-AC; Makanan & minuman: Restoran, Bar, Room service, Sarapan, Sarapan prasmanan; Kesehatan: Gym, Spa; Hewan peliharaan: Hewan peliharaan tidak diizinkan; ","Lat: -6.9060674, Lng: 107.6205874",http://lh5.googleusercontent.com/p/AF1QipOKnqx3CN6tyRcppoO1E8_2BIxoc4ESuDQc2d0w=w252-h168-k-no; http://lh4.googleusercontent.com/proxy/oVGA1yIfN6EgLwzvFvcTQ38JdrIrbHsWnwBha-wBA2ql7ggFEfzHWhP-KYCdLByMWcTcJ--xPWPa4RWd1YIM1F72V_FPzjTdF737ib30QyzG-pmkjhew_R7sI1VVu8krg8gBLTnF-PQe4VshYFSqGdWidVkqlQ=w252-h168-k-no; http://lh5.googleusercontent.com/p/AF1QipNbIrEBA3-OCRoYbGjy__ocWtHeZ0Sn5mcnar0H=w252-h168-k-no; http://lh5.googleusercontent.com/p/AF1QipO0Ayji-_BVIpY0wkBaUXSinEwt8G-xQnT033TP=s367-w367-h248-n-k-no; http://lh5.googleusercontent.com/p/AF1QipP951OCKxX3XkEU-J7k0XdIPNZY_3Y7QY62QBFO=s367-w367-h248-n-k-no; http://lh5.googleusercontent.com/p/AF1QipOOaN8E3pcY9DEaIA7AbADcctoZ35TP3Pyv2gM=s367-w367-h248-n-k-no; http://lh5.googleusercontent.com/p/AF1QipN0ALQVfNGl43P-PMGJI-JkjVOSI_eOlKIAskyA=s367-w367-h248-n-k-no; http://lh5.googleusercontent.com/p/AF1QipMdaNZHXgncpnjkfs9NKLhKq5XLybdo_X4maJfK=s367-w367-h248-n-k-no; http://lh5.googleusercontent.com/p/AF1QipNm6xttpVWYI6fuHbpSxsnbMPZTYSNcbmzvU8Z3=s367-w367-h248-n-k-no; http://lh5.googleusercontent.com/p/AF1QipMhlfezCoj5pgZ2CS9U-U6aUFcD0Izhk_ljXGoe=s367-w367-h248-n-k-no
ChIJO1jUpNfnaC4RKps6Pq9pk3c,"4,8","13,5 rb","Jl. Gatot Subroto No.289, Cibangkong, Kec. Batununggal, Kota Bandung, Jawa Barat 40273",(022)87348888,Hotel bintang 5,"Kolam renang: Kolam renang luar, Bak air panas; Internet: Wi-Fi; Layanan: Resepsionis, Penatu layanan lengkap; Anak: Cocok untuk anak; Parkir & transportasi: Tempat parkir, Parkir valet, Jemputan bandara; Aksesibilitas: Ramah difabel; Bisnis & acara: Business center; Kamar: Ber-AC; Makanan & minuman: Restoran, Bar, Makan malam prasmanan, Room service, Sarapan, Sarapan prasmanan; Kesehatan: Gym, Sauna, Spa, Salon rambut; Hewan peliharaan: Hewan peliharaan tidak diizinkan; ","Lat: -6.927052000000001, Lng: 107.6362678",http://lh3.googleusercontent.com/proxy/5Ca7OteKu0PZ3QJqwAiEzKVO-5mFNtvKvpSjhYVD2e2xpJSvFwEPqzt2zhrJFTIydm1AOvJnHeANXiDbNVVdN7cDYAgeytjNm6EP_RLQUKjXIt-QYUfRA29WDN2mw4y9oHhVEND_ANy0LbaSDUBghNqc3QuqNw=w252-h168-k-no; http://lh5.googleusercontent.com/p/AF1QipOr5IiPE0LKrZZteKgczpkIhmYO02fIy3XKHAxI=w252-h252-k-no; http://lh5.googleusercontent.com/p/AF1QipN-ZuEXcXcU27JqJFphJUXm4Ol6HgFG5W2n-VtC=w252-h560-k-no; http://lh5.googleusercontent.com/p/AF1QipPKwW_oxWjY3ckFflb4LwGnNMVudKWvla0jDkth=s367-w367-h248-n-k-no; http://lh5.googleusercontent.com/p/AF1QipPso_lngnQcFXu-C5uVkdV9VCLOhCcr9_mEUwie=s367-w367-h248-n-k-no; http://lh5.googleusercontent.com/p/AF1QipPcWrbxt2l8VZaGSchEB2D1OB6OAblgdyL-kbnA=s367-w367-h248-n-k-no; http://lh5.googleusercontent.com/p/AF1QipObJtJukc7fZn2pEQAepKE_boqXEw7lhSiucSbo=s367-w367-h248-n-k-no; http://lh5.googleusercontent.com/p/AF1QipNaSPDmXdS8gnWnO5nCGgDEm7LcKkBruuRFetkR=s367-w367-h248-n-k-no; http://lh5.googleusercontent.com/p/AF1QipM-D5V5ouaEup2pxO0jf-CJTe4f4evjalgIJ5no=s367-w367-h248-n-k-no; http://lh5.googleusercontent.com/p/AF1QipOE01PXCh0WfqrxRkXPPMWGD2mqmqlkfMSq_MiI=s367-w367-h248-n-k-no; http://lh5.googleusercontent.com/p/AF1QipMf4vy4JMrkzLz6S5HX_ubNbrTWjOmF7iRCj29e=s367-w367-h248-n-k-no; http://lh5.googleusercontent.com/p/AF1QipMuuSw2rVpnPi1N9T-bG_KOflmoWxvxfWGCfu1t=s367-w367-h248-n-k-no; http://lh5.googleusercontent.com/p/AF1QipN-7HQGFHej8gKXeZexfakzE7jYfnQApEisfDkQ=s367-w367-h248-n-k-no
ChIJoR1x9gDnaC4RWjjSXQD8q58,"4,4",982,"Jl. Asia Afrika No.74 - 76, Balonggede, Kec. Regol, Kota Bandung, Jawa Barat 40261",(022)20506088,Hotel bintang 2,"Internet: Wi-Fi; Layanan: Resepsionis, Penatu layanan lengkap; Parkir & transportasi: Tempat parkir; Kesehatan: Tidak memiliki gym, Tidak menyediakan spa; Makanan & minuman: Restoran, Room service, Sarapan, Sarapan prasmanan; Kolam renang: Tidak menyediakan kolam renang, Tak ada bak air panas; Hewan peliharaan: Hewan peliharaan tidak diizinkan; Kamar: Ber-AC; ","Lat: -6.921193799999999, Lng: 107.6061891",http://lh3.googleusercontent.com/p/AF1QipMjr3t25tDH4rFEMqLvtsXT3Gsz62bQZOBomgPx=w252-h448-k-no; http://lh3.googleusercontent.com/gvs/AG4uZQlD2c6lumM8cY0lpi0wt1wahVtTmv1Xogpb3Pxa6GmGRWNVbH7gDn7oF9GJoikvnSiddrfbjv82iBpOkJi7667GQekSPXWVmrvn; http://lh6.googleusercontent.com/proxy/YOEtgNoHuel3san2rCruq3DwL1KCWcIz2AbbByLAYL-UeH5RSydH0SF5QPTlUgS0kaTJ3qoC9KVg8c2aunSnHYOACIY4UGZQya4oeUODQcFrAoWlhSYx63U5rRDyUs0-iYv_wusqXcvvZHO6jRA-Yx71nF34pw=w252-h185-k-no
ChIJ66PbeC_maC4RMxLwD6swTL0,"4,5","6,2 rb","Jl. Braga No.8, Babakan Ciamis, Kec. Sumur Bandung, Kota Bandung, Jawa Barat 40111",(022)4213070,Hotel bintang 4,"Kolam renang: Kolam renang luar, Tak ada bak air panas; Internet: Wi-Fi; Layanan: Resepsionis, Penatu layanan lengkap, Elevator; Anak: Cocok untuk anak, Aktivitas untuk anak, Klub anak-anak; Parkir & transportasi: Tempat parkir, Parkir mandiri, Antar jemput bandara; Aksesibilitas: Ramah difabel; Hewan peliharaan: Hewan peliharaan tidak diizinkan; Makanan & minuman: Restoran, Bar, Pesan tempat makan, Makan malam prasmanan, Room service, Sarapan, Sarapan prasmanan, Mesin penjual otomatis; Kesehatan: Gym, Pijat, Spa; Bisnis & acara: Business center; Kamar: Ber-AC, Dapur; Efisiensi energi: Program konservasi energi, Penggunaan energi diaudit oleh organisasi independen, Sistem pemanas dan pendingin hemat energi, Pencahayaan hemat energi, Termostat hemat energi; Pengurangan sampah: Program pengurangan sampah makanan, Kelebihan makanan didonasikan, Zat berbahaya ditangani dengan aman, Elektronik, baterai, dan bola lampu dibuang dengan aman, Botol perlengkapan mandi yang dapat diisi ulang, Pos pengisian ulang botol air, Tidak ada botol air dan sedotan plastik sekali pakai; Konservasi air: Penggunaan air diaudit oleh organisasi independen, Keran, toilet, dan shower hemat air, Program penggunaan ulang handuk dan linen; Pengambilan sumber daya yang berkelanjutan: Makanan dan minuman dari bahan-bahan lokal, Hidangan vegetarian, Perlengkapan mandi ramah lingkungan; ","Lat: -6.920773, Lng: 107.610037",http://lh4.googleusercontent.com/proxy/gRrm-p4IaJLJKMTxD3X0au3rrQJtA0x2SRxt7wSEzcLFae_ZL7SYy4KkFEOnGyZLHwaUz9iqISGan-oInJTzc9KH85VJFb8oFKW33tVjRUfjR6FVYoTyfxxbmZzU66Ry1js4dtHqnr8SAFpTTHeYjUdvfGW9FEE=w252-h168-k-no; http://lh5.googleusercontent.com/p/AF1QipMjZVYWgd-uJ5N2DWLSd5MrU6H2eZruZHt3RXeL=w252-h189-k-no; http://lh5.googleusercontent.com/p/AF1QipNBWWwKr9ddEdSprWQeVzkPiVuhnYqq1hSWTYCB=w252-h168-k-no; http://lh5.googleusercontent.com/p/AF1QipNKsx6b8obRR2qaust8QS6kgdlPmtvQg6scgePt=s367-w367-h248-n-k-no; http://lh5.googleusercontent.com/p/AF1QipP7PqbnhTNKnRGbPfn4zy4y2zC0EpBMwJHxOaNc=s367-w367-h248-n-k-no; http://lh5.googleusercontent.com/p/AF1QipM727OBa0gBb1EjM_KuKFSD5gpHY52QIXY1_rez=s367-w367-h248-n-k-no; http://lh5.googleusercontent.com/p/AF1QipO36Mr0e4yY4inDLtv8W3AOLRgZrr2Lhrs7VGgJ=s367-w367-h248-n-k-no; http://lh5.googleusercontent.com/p/AF1QipOskctMnacc3cZfleahvWi8Jo1fODEdYYpJKVHr=s367-w367-h248-n-k-no; http://lh5.googleusercontent.com/p/AF1QipOxwq-CPqMwwHBolCHfSvG2Lf0Lv5KzCNK6OxoI=s367-w367-h248-n-k-no; http://lh5.googleusercontent.com/p/AF1QipMT9ZwuIPW94-oClwnQ7xLj9ZISna9BxqSuQgiF=s367-w367-h248-n-k-no; http://lh5.googleusercontent.com/p/AF1QipOUe1YJQAONZ4ecX5e_915eXyPgjx6TTG5oNpQm=s367-w367-h248-n-k-no; http://lh5.googleusercontent.com/p/AF1QipOaAOJohBPL8zLjF1Sj6BK-47aucrZT5mQv-lom=s367-w367-h248-n-k-no; http://lh5.googleusercontent.com/p/AF1QipOifY6Wm3RxLVLaTEPX9NPaqXH0xu1U5YhKkmNc=s367-w367-h248-n-k-no
ChIJE0XCm0nmaC4RK4j8gic7beI,"4,6","2,4 rb","Jl. Bahureksa No.3, Citarum, Kec. Bandung Wetan, Kota Bandung, Jawa Barat 40115",(022)4203999,Hotel bintang 3,"Internet: Wi-Fi; Layanan: Resepsionis, Penatu layanan lengkap; Kolam renang: Tidak menyediakan kolam renang, Tak ada bak air panas; Kesehatan: Tidak memiliki gym; Kamar: Ber-AC; Makanan & minuman: Restoran, Room service, Sarapan, Sarapan prasmanan; Anak: Cocok untuk anak; Parkir & transportasi: Tempat parkir; Hewan peliharaan: Hewan peliharaan tidak diizinkan; ","Lat: -6.9051306, Lng: 107.613992",http://lh6.googleusercontent.com/proxy/9zhSXDMWOmfQ2L7JE-Ag3KPkeAmm1GahCLIzYYwpEASF3oLoDL9iHycpkKQ3t5ZBO2BgTrZ_exmE3FlQ9wfnTiytgPlvqM-m3W8YGd9RmYNk68wXIIFnkNhOCfWGAZhT-SYofcIYwJ8aAO2B3HUWMnffkh44nxA=w252-h167-k-no; http://lh5.googleusercontent.com/p/AF1QipMoKRn_jjw1DRuQOmWhJkEqUGj1qmgm7QJTeLmf=w252-h168-k-no; http://lh5.googleusercontent.com/p/AF1QipPnrgfCaQ2dbdTNYFfgtDtcvHCD_KvXqBrFmVeF=w252-h168-k-no; http://lh5.googleusercontent.com/p/AF1QipN3ZFgS6P5sXN9M87rfsV3H3-bxJCGJ2DfDILOq=s367-w367-h248-n-k-no; http://lh5.googleusercontent.com/p/AF1QipN5uP8IrO3PNgr55MRNXiYIpl-4osRx8rqaouHS=s367-w367-h248-n-k-no; http://lh5.googleusercontent.com/p/AF1QipO18vEKNDY6hv9AhpNjhMAID2axtPA8W5wyh17W=s367-w367-h248-n-k-no; http://lh5.googleusercontent.com/p/AF1QipM0r3WeTSjWP_izWw6dnvXpx_Z1sNq34FEkVu2f=s367-w367-h248-n-k-no; http://lh5.googleusercontent.com/p/AF1QipM9SXVSL8TAHj9zb0xOIboeaQyUvhhJVCxuGqDQ=s367-w367-h248-n-k-no
ChIJsf-WmjfmaC4RzHrPQIO7gXo,"4,6","8,4 rb","Jl. Merdeka No.25-29, Babakan Ciamis, Kec. Sumur Bandung, Kota Bandung, Jawa Barat 40117",(022)42690555,Hotel bintang 4,"Kolam renang: Kolam renang di dalam ruangan, Kolam renang luar, Kolam berendam; Internet: Wi-Fi, Wi-Fi di area publik; Kebijakan & pembayaran: Kartu kredit, Kartu debit, Tunai; Anak: Cocok untuk anak, Klub anak-anak; Kesehatan: Gym, Mesin eliptik, Treadmill, Angkat beban, Pijat, Spa, Dokter panggilan; Bisnis & acara: Business center, Ruang rapat; Kamar: Ber-AC, Dapur di beberapa kamar, Lemari es, Microwave, Mesin pembuat kopi, Minibar; Makanan & minuman: Restoran, Bar, Pesan tempat makan, Room service, Sarapan, Sarapan prasmanan; Layanan: Resepsionis, Concierge, Kurs mata uang, Penatu layanan lengkap, Elevator, Layanan membangunkan, Tata graha; Parkir & transportasi: Tempat parkir, Parkir valet, Jemputan bandara, Penyewaan mobil di tempat; Aksesibilitas: Ramah difabel, Fasilitas parkir difabel; Hewan peliharaan: Hewan peliharaan tidak diizinkan; Bahasa yang digunakan: Inggris, Indonesia; Kamar mandi: Bak mandi di beberapa kamar, Pancuran; ","Lat: -6.909234499999999, Lng: 107.6103071",http://lh3.googleusercontent.com/p/AF1QipN069lN2xoiP86mRUMVrFWkJWruIjLGghyO9WEy=w252-h142-k-no; http://lh5.googleusercontent.com/p/AF1QipNrBjLk6V5phjpyEKZp9uWkMcRQamzKn316XhoW=w252-h170-k-no; http://lh3.googleusercontent.com/proxy/6lh69Umk4-cDjAUOZdjrwR4g-TD4fEjRZEcm8PiYO0tbMpcqObhvNXv-3SJ1BjfZLrFpmokkyo7UYLgppbdvQIfQ-jsZaUuY6pVjYpTKKsYFwSIaijAUH9chiRyW1Ohl_P4tcjRZrvE2w_OWBEfvLkIlSV7i-0s=w252-h165-k-no; http://lh5.googleusercontent.com/p/AF1QipONVFafsCGltg42VW6fV87pfvZ7fiONKTfy45Kn=s367-w367-h248-n-k-no; http://lh5.googleusercontent.com/p/AF1QipMKTcvTlRUn4UH01gIMK-FBWdc4rD2hGCagTdH4=s367-w367-h248-n-k-no; http://lh5.googleusercontent.com/p/AF1QipOnACRUXf4UbAcYZo60ygp4lyX_4gtOYVCg-0uU=s367-w367-h248-n-k-no; http://lh5.googleusercontent.com/p/AF1QipPCGI8b4dlC_WGjW3V-yJrDZp5iGgo5YnLtHXRd=s367-w367-h248-n-k-no; http://lh5.googleusercontent.com/p/AF1QipPKaKPJZuAProzo3u4ap1NeOCwLXDRbr5zRVRdr=s367-w367-h248-n-k-no
ChIJ5QfRCrXnaC4RMfbOnMZejaw,"4,1",248,"Masuk dari Pintu Prama Supermarket, Jl. Garuda No 79-83, Dungus Cariang, Kec. Andir, Kota Bandung, Jawa Barat 40184",8170896688,Hotel bintang 4,"Internet: Wi-Fi; Kolam renang: Tidak menyediakan kolam renang, Tak ada bak air panas; Layanan: Resepsionis; Parkir & transportasi: Tempat parkir; Kesehatan: Tidak memiliki gym, Tidak menyediakan spa; ","Lat: -6.911192, Lng: 107.578405",http://lh3.googleusercontent.com/gps-cs-s/AB5caB-8k89FuKvGCJlKqOBCCKosQSXquGXlcqJgkxkhOa95TbsUhpnlR5PpV76qQvyNkIBYi6MJi6b-yOaJs3IkGoqMPZl_8n7-9bDvUUu8uN9MJl8-UMaByMT5j0UeiG2duTgbwut7=w252-h448-k-no; http://lh5.googleusercontent.com/p/AF1QipM67rVVYWDvQurFgqc2MDRtXG8xmwOfZOiizL40=w252-h189-k-no; http://lh5.googleusercontent.com/p/AF1QipPE68Y-otpP9eP-m6N6RvLONZqmZuOysH2IJjru=w252-h336-k-no
ChIJvSoC1XfoaC4RRNu3ybQ7p7k,"4,5","13,4 rb","Jl. Gatot Subroto No.289, Cibangkong, Kec. Batununggal, Kota Bandung, Jawa Barat 40273",(022)87345555,Hotel bintang 3,"Internet: Wi-Fi, Wi-Fi di area publik; Layanan: Resepsionis, Penatu layanan lengkap, Elevator, Layanan membangunkan; Kolam renang: Tidak menyediakan kolam renang; Kesehatan: Tidak menyediakan spa; Aksesibilitas: Ramah difabel, Fasilitas parkir difabel; Hewan peliharaan: Hewan peliharaan tidak diizinkan; Kamar: Ber-AC, Mesin pembuat kopi; Makanan & minuman: Restoran, Bar, Makan malam prasmanan, Room service, Sarapan, Sarapan prasmanan; Anak: Cocok untuk anak, Klub anak-anak; Parkir & transportasi: Tempat parkir, Parkir valet, Jemputan bandara; Bisnis & acara: Business center, Ruang rapat; Bahasa yang digunakan: Inggris, Indonesia; Kamar mandi: Kamar mandi pribadi, Pancuran; Efisiensi energi: Penggunaan energi diaudit oleh organisasi independen, Pencahayaan hemat energi; Pengurangan sampah: Program pengurangan sampah makanan, Kelebihan makanan didonasikan, Zat berbahaya ditangani dengan aman, Elektronik, baterai, dan bola lampu dibuang dengan aman, Tidak ada sedotan plastik sekali pakai; Konservasi air: Penggunaan air diaudit oleh organisasi independen, Keran, toilet, dan shower hemat air, Program penggunaan ulang handuk dan linen; Pengambilan sumber daya yang berkelanjutan: Makanan dan minuman organik, Makanan dan minuman dari bahan-bahan lokal, Telur organik dari unggas yang dipelihara tanpa kandang, Hidangan vegetarian, Perlengkapan mandi ramah lingkungan; ","Lat: -6.927261, Lng: 107.636406",http://lh5.googleusercontent.com/p/AF1QipMh2ENSCmbX9HzLaZtWPI7uhknwX2KHhAlZGM8K=w252-h168-k-no; http://lh3.googleusercontent.com/gvs/AG4uZQlsppIw_arYu1PfKmPpVI2gin9FPkJvxk_BY8JiEQXVbLYs1Xnjma_MfHZ0ALX_efGz7U2bMmRHfuvrB3zkWVuMJMXTlLHz7v94; http://lh4.googleusercontent.com/proxy/btfaFO_WlZxmiW8AFg-2s9ciolj5359rYTGY43LZsBYfDPnyxqP3kAZSoGB7GHRA4xA6ch7KAQmguXZckzWy6ZTFfJAt9pS3x1V-i5PI8nYtUtOpbXP5hoEWanzaHsuZpjeGsfzS1XI4AfzhwT_ptSGHtnqcQQ=w252-h189-k-no
ChIJ2QJRoKPoaC4RENJdhXx1dbY,"4,4","7,8 rb","Jl. Peta No.147 - 149, Suka Asih, Kec. Bojongloa Kaler, Kota Bandung, Jawa Barat 40231",(022)6043135,Hotel bintang 4,"Kolam renang: Kolam renang luar, Tak ada bak air panas; Internet: Wi-Fi, Wi-Fi di area publik, Tempat kerja dengan internet publik; Kebijakan & pembayaran: Kartu kredit, Kartu debit, Tunai; Anak: Cocok untuk anak; Kesehatan: Gym, Pijat, Spa, Dokter panggilan; Bisnis & acara: Business center, Ruang rapat; Bahasa yang digunakan: Inggris, Indonesia; Makanan & minuman: Restoran, Bar, Room service, Sarapan, Sarapan prasmanan; Layanan: Resepsionis, Concierge, Minimarket, Kurs mata uang, Penatu layanan lengkap, Elevator, Tata graha; Parkir & transportasi: Tempat parkir, Jemputan bandara, Penyewaan mobil di tempat, Antar-jemput lokal; Aksesibilitas: Ramah difabel; Hewan peliharaan: Hewan peliharaan tidak diizinkan; Kamar: Ber-AC; ","Lat: -6.936666199999999, Lng: 107.5935451",http://lh5.googleusercontent.com/proxy/xWlUURAr-SnnU6nY9x_i9xifCd4kauQB2K1XXOfQu31fgFz6fARMKejqWjbwczjdQX9IH9qrHoJdsX5NsSqglH_VNNFwIt5G7-CuYWH2sKJuudVFSYOBKTRzPT3d0pJS6tmudzclX207w9s66jgf617ziH2p3g=w252-h165-k-no; http://lh5.googleusercontent.com/p/AF1QipOxHOQlgE08FlcO2d4B-0AU2c07BbTXLbkCVeIi=w252-h178-k-no; http://lh3.googleusercontent.com/proxy/MQ-w2DyvAVUtBzbOgnQFaENkuzaYF__swUBtJB1Z_IRwRIgnhjN75qI9SdPkbApnYA7uKwbsEowqtLJJGAC5CgE5EDoNaxRjEtn0s3xKpXqqafQGh-_OhPIv6laZq1Jd1p3E1X6zXI3WnQAdFgROapkrXcYqHw=w252-h167-k-no; http://lh3.googleusercontent.com/gps-cs-s/AB5caB_xZ85MPif9-jBSHEOnLtZtiHKuMlFtE_ugTKbmV8xLZdKw8r818rBAlmaGBkRB_Ha_Dqd0ATGtgDslY6nnQZYsHnjtNSdeJUTK94K7FVDGHgp8MZjr6ei9F49YPrL_Gd9jXfc=s367-w367-h248-n-k-no; http://lh3.googleusercontent.com/gps-cs-s/AB5caB9KITLmeMbCORi9BMYscDn4X7atDaNc_mq8J2Zzl8aJuLSxUn5Pqcb6GaAgqmd7f9fp5xgxtp3NGm6UjgbPWYC3tticFlF0wsPZUV1_WKhiiwhy12tRd6TsqJmzBtucvnHeNwtFdA=s367-w367-h248-n-k-no; http://lh3.googleusercontent.com/gps-cs-s/AB5caB_zI62xILVlaL63C8YLvaNVqJj1cTQHi0PLh6v2Sq-55tFlziJzAcC_hX0ZKh2--pMNVvjmpjPlTFybixrrDXfGfIso5mPUE8Pk54gVLcc4NFVaRmtiizK6MMhzVZtA_Y5hW_PR=s367-w367-h248-n-k-no
ChIJ-ZsI4cfoaC4R73zdjVxD37Q,"4,3","2,7 rb","Jl. Raya Kopo No.459, Cirangrang, Kec. Babakan Ciparay, Kota Bandung, Jawa Barat 40227",(022)54410688,Hotel bintang 3,"Internet: Wi-Fi, Wi-Fi di area publik; Layanan: Resepsionis, Penatu layanan lengkap; Kolam renang: Tidak menyediakan kolam renang, Tak ada bak air panas; Kesehatan: Tidak memiliki gym, Spa; Kamar: Ber-AC; Makanan & minuman: Restoran, Room service, Sarapan, Sarapan prasmanan; Anak: Cocok untuk anak; Parkir & transportasi: Tempat parkir, Jemputan bandara; Hewan peliharaan: Hewan peliharaan tidak diizinkan; ","Lat: -6.952062199999999, Lng: 107.5863599",http://lh5.googleusercontent.com/p/AF1QipP7ENu2Vxm0vwhrc-rYpYPc0EsMec_yN2ffx7JB=w252-h378-k-no; http://lh5.googleusercontent.com/proxy/REw5EOmQO44W1zR7S5VYLBoDMLJIeJ1jMwVkgXG50L8MDspb2XHKVG0zvaKkkednzJEazpwjldgiaAgdCYK4ZkNt4-N6yYaU8vNxYfCAxT4SzbFyJAGR_nbItVOIUHl9c16Y_W51N4_Af3kMUB-_9kdhj71nz2s=w252-h168-k-no; http://lh6.googleusercontent.com/proxy/uIGF9ThwaEjCT1AqghnuOMG98snJt4qPsm2iRWyXWVsOciHv3r_3JdoOhZz3KkNdbVsbEtEPhJvsA82P3AfbVVV9MydLNzdHnnxotN2pcKTW9AL420SzjlwlvBsigraVl8qjWVUKAuN7RHPVwNyr3ikA3fkq-g=w252-h168-k-no
ChIJ87Ou9mznaC4RDo1aWkc68mk,"4,8","3,8 rb","Jl. Diponegoro No.27, Citarum, Kec. Bandung Wetan, Kota Bandung, Jawa Barat 40115",(022)86038888,Hotel bintang 3,"Internet: Wi-Fi, Wi-Fi di area publik, Tempat kerja dengan internet publik; Kebijakan & pembayaran: Kartu kredit, Kartu debit, Tunai; Anak: Cocok untuk anak, Klub anak-anak; Kolam renang: Tidak menyediakan kolam renang, Tak ada bak air panas; Parkir & transportasi: Tempat parkir, Parkir mandiri, Parkir valet, Pengisi daya EV, Jemputan bandara, Layanan mobil pribadi, Antar-jemput lokal; Hewan peliharaan: Hewan peliharaan tidak diizinkan; Kamar: Ber-AC, Mesin pembuat kopi, Minibar; Makanan & minuman: Restoran, Room service, Sarapan, Sarapan prasmanan; Aktivitas: Penyewaan sepeda; Layanan: Resepsionis, Penyimpanan bagasi, Penatu layanan lengkap, Elevator, Layanan membangunkan, Tata graha, Layanan turndown; Kesehatan: Tidak menyediakan spa, Dokter panggilan; Aksesibilitas: Ramah difabel, Fasilitas parkir difabel; Bisnis & acara: Business center; Bahasa yang digunakan: Inggris, Indonesia; Kamar mandi: Pancuran; Pengurangan sampah: Program pengurangan sampah makanan, Pos pengisian ulang botol air, Wadah dan alat makan yang dapat dikompos, Tidak ada botol air dan sedotan plastik sekali pakai; Pengambilan sumber daya yang berkelanjutan: Makanan dan minuman dari bahan-bahan lokal, Hidangan vegetarian dan vegan; ","Lat: -6.9002284, Lng: 107.6175478",http://lh5.googleusercontent.com/p/AF1QipMjVAIH2OBPA943dKzIKaG_8PkRq2YxV4A_tp-c=w252-h167-k-no; http://lh5.googleusercontent.com/p/AF1QipMnplvERzr17Q3ur44VlC98tWDkDHBBz84VbDeE=w252-h189-k-no; http://lh5.googleusercontent.com/p/AF1QipPfSRAmMwrP-mQoKZruC7dyp_hAMDd0kYXIX3oN=w252-h448-k-no
