hotel_id,rating,reviews_count,location,contact,category,amenities,coordinates,thumbnails
ChIJR2XbVnzoaC4Rrcm3RoIWbQo,"4,2","10,3 rb","Jl. Pelajar Pejuang 45 No.121, Turangga, Kec. Lengkong, Kota Bandung, Jawa Barat 40264",(022)7305000,Hotel bintang 4,"Kolam renang: Kolam renang luar, Kolam berendam, Tak ada bak air panas; Internet: Wi-Fi; Layanan: Resepsionis, Penatu layanan lengkap; Kesehatan: Gym, Sauna, Spa; Hewan peliharaan: Hewan peliharaan tidak diizinkan; Makanan & minuman: Restoran, Room service, Sarapan, Sarapan prasmanan; Anak: Cocok untuk anak; Parkir & transportasi: Tempat parkir, Jemputan bandara; Aksesibilitas: Ramah difabel; Bisnis & acara: Business center; Kamar: Ber-AC; ","Lat: -6.935329299999999, Lng: 107.6252088",http://lh5.googleusercontent.com/p/AF1QipN2CoiIbi2nnvyHlpNNZoFMgOQBjhOT4kWicmd0=w252-h144-k-no; http://lh5.googleusercontent.com/proxy/Pgrg8BQ949rJHlGt1ZCzfxFmKqJAlIomszcF6yZn-weTDOdTxORPoon2_D8am0t5T5VxdesVPIzTO4iL40x1UFcgP1aLSHdtaK_Jozzty-KBBLwI7yCoi_ZVtsntN1_pfvZaH8vIebXk1ROG4gFmRF9JkL2Tsco=w252-h168-k-no; http://lh3.googleusercontent.com/gvs/AG4uZQnkxohoQ1ev4hyD2HO9XrmswNGdvhgmAtoaivho_DcpTY45XV0ReCq-KBqOep2YLk81ZalNSNxLbqVjjgUkPm-JqNE_TEUkHV-K; http://lh5.googleusercontent.com/p/AF1QipOVWdJwlghjEIlyJcQyxHoUOYCJWKMwkKP3pClF=s367-w367-h248-n-k-no; http://lh5.googleusercontent.com/p/AF1QipMWR4AJwu63lnsn4zFpEEUwr5z-KxXGU6kiITA=s367-w367-h248-n-k-no; http://lh5.googleusercontent.com/p/AF1QipOtTNRPtye5Ri5fJkeMlmFOuqSbQl4i5og7v4hI=s367-w367-h248-n-k-no; http://lh5.googleusercontent.com/p/AF1QipNSAlbFt5xa681vSk6FFH3Q4MdA_V4fpcd6CNs=s367-w367-h248-n-k-no; http://lh5.googleusercontent.com/p/AF1QipMSRLPmEzSU3lPLejp1yCiYUYP8MSX4I3jT4QJo=s367-w367-h248-n-k-no; http://lh5.googleusercontent.com/p/AF1QipN0Dqgz-aCgcj22AVM9RWtqiK02xHCjm_C8boNf=s367-w367-h248-n-k-no; http://lh5.googleusercontent.com/p/AF1QipPbaIyZp3al3CiGG2Iz70m4quBdl-3GbPZMgXVh=s367-w367-h248-n-k-no; http://lh5.googleusercontent.com/p/AF1QipNFDbvdXDM7ZGx5eXY01sNybZ83SgwuJwHqfJ8z=s367-w367-h248-n-k-no; http://lh5.googleusercontent.com/p/AF1QipNg-AYQR-jH-9xndjb9K6sTQ6G19QjIzyBBkQXp=s367-w367-h248-n-k-no; http://lh5.googleusercontent.com/p/AF1QipPwLCbDJjYXirc5HtozMhH0-9Ho4LNaPHrzOcnf=s367-w367-h248-n-k-no; http://lh5.googleusercontent.com/p/AF1QipP2xS4sRn-Sn6CgjUypr1flCcSsAJlr-5C2vera=s367-w367-h248-n-k-no; http://lh5.googleusercontent.com/p/AF1QipOByAH9pMjgURZFvu_LBOJ8XeihkR32_HRjr5W1=s367-w367-h248-n-k-no
ChIJd9tPhxzoaC4RxHBKCi82lDU,"4,2","3,6 rb","Jl. Soekarno-Hatta By Pass Timur No.713, Jatisari, Kec. Buahbatu, Kota Bandung, Jawa Barat 40286",(022)7332088,Hotel bintang 3,"Kolam renang: Kolam renang luar, Tak ada bak air panas; Internet: Wi-Fi; Layanan: Resepsionis, Penatu layanan lengkap; Kesehatan: Gym, Sauna; Kamar: Ber-AC; Makanan & minuman: Restoran, Room service, Sarapan, Sarapan prasmanan; Anak: Cocok untuk anak; Parkir & transportasi: Tempat parkir; Hewan peliharaan: Hewan peliharaan tidak diizinkan; ","Lat: -6.938430899999999, Lng: 107.6631013",http://lh3.googleusercontent.com/proxy/WrLdE5JRQJVu2ab-T9je-3dweALjzJ5jgiRfskGzM0BdS8DODG_Ow3E8XnO6Vw7fFkWB0aZ9YnJcR6m_aD5oF5-qtlIdkx8b8WaUmmc5Goq4pF43cx6WqTtsqJsDPC_jzNhLP3o_UqvZ5oEgcro8MtxSmkDzCA=w252-h168-k-no; http://lh5.googleusercontent.com/proxy/nzM3Tf6DrXZcgCckDoO1xYLJqtTn94wJVA5FFVRdPdlakY1SR5g9ej7j48mR7RvKNwZco10xYIUhyjun2_-2NjPcEHCJDJruoE7xWnEvY_N40DPtJLt8h7Rtxx-v6dhUfmgfYXFXauApMVmAUV2fwFUIJdIL2g=w252-h189-k-no; http://lh5.googleusercontent.com/p/AF1QipNszeqv4sWrwIgyJ9Xr4nsLvO8xE-W-FFV7m1fs=w252-h189-k-no
ChIJZRnuuQvmaC4ReCG15Q1u2Ho,"4,3","4,3 rb","Jl. LMU.Nurtanio No.63, Dungus Cariang, Kec. Andir, Kota Bandung, Jawa Barat 40183",(022)20565858,Hotel bintang 4,"Internet: Wi-Fi; Layanan: Resepsionis, Penatu layanan lengkap; Kolam renang: Tidak menyediakan kolam renang, Tak ada bak air panas; Kesehatan: Tidak memiliki gym, Tidak menyediakan spa; Bisnis & acara: Ruang rapat; Kamar: Ber-AC; Makanan & minuman: Restoran, Room service, Sarapan, Sarapan prasmanan; Anak: Cocok untuk anak; Parkir & transportasi: Tempat parkir, Jemputan bandara; Aksesibilitas: Ramah difabel; Hewan peliharaan: Hewan peliharaan tidak diizinkan; ","Lat: -6.9127049, Lng: 107.5780691",http://lh3.googleusercontent.com/p/AF1QipOrBh5M4gYvItJkUmxbIdQT5oPqEp9xOXtx-8sZ=w252-h503-k-no; http://lh3.googleusercontent.com/proxy/UEv846Wb1P7LAqGa_9pydT6vpohHQ2065H3oP2qpcYscK8naFcYazq9uD1LK4mMvbgKFKZpkvujolz1-t0su4qAG72yM4Tn2Ak0i4-TRSLmNOUWkrgGPYXxKcratD_f4t2qCnUNGe1sGGZWJSf8JcGtwmjKFxmI=w252-h168-k-no; http://lh4.googleusercontent.com/proxy/orUUBCiK8m-dMwWTy_zBfKlbIoxvpZUAXAjg8z9Xai5f9g4VNiw8NyGj0ErbHv_mzp4MWOnvAKeKSaa7X8LgZaUbK7evpQAY7iPdo2TRGwRNVssZqufYlKlI0qUz0NwQjJqjGSocplsyZM7qHRZJof_yIwcIgTE=w252-h167-k-no
ChIJ6Rt6U0nnaC4RMgoC4IJ4WYg,"4,6","3,2 rb","Jl. Braga No.10, Braga, Kec. Sumur Bandung, Kota Bandung, Jawa Barat 40111",(022)86016100,Hotel bintang 4,"Kolam renang: Kolam renang luar, Kolam berendam, Tak ada bak air panas; Internet: Wi-Fi; Layanan: Resepsionis, Penatu layanan lengkap; Kesehatan: Tidak memiliki gym; Hewan peliharaan: Hewan peliharaan tidak diizinkan; Kamar mandi: Bak mandi di beberapa kamar, Pancuran di beberapa kamar; Makanan & minuman: Restoran, Room service, Sarapan, Sarapan prasmanan; Anak: Cocok untuk anak; Parkir & transportasi: Tempat parkir, Jemputan bandara; Bisnis & acara: Ruang rapat; Kamar: Ber-AC, Mesin pembuat kopi, Minibar; ","Lat: -6.920351399999999, Lng: 107.6100873",http://lh4.googleusercontent.com/proxy/xr4cT6nmEZjD3pEPxOz3NF6c9Q53nfj2-KSIacOcTwGserUxT2VmGgxZQIbbIiFqVPbQBfQRhQyDxnlOYswlv0cSsMnU1FCexZtYd3LceWlE8nMc4kdYIx_USjDVgbsXzsvLbl_UBTFMgWwg3MFqHTlVl2MhN-A=w252-h173-k-no; http://lh4.googleusercontent.com/proxy/GJIAOEtCdWmfeXOnwxFaPX89CgKV3EiNh62xzxIgFNmOvL9kJ17A6i-LHwyFzKAtCw3Mq0uNnbeOX8ezT4H32NoppEN8syLkKOxLEczguko_89B7t4l7K8Ws5KFW1HFedffKSGQKO8MJXa9BzBR87QG7oM1ImQM=w252-h168-k-no; http://lh5.googleusercontent.com/p/AF1QipMCn8metcSnkdYa_UuWWQ73-lbd6eYD_qAHZg2V=w252-h185-k-no
ChIJHREpHC_maC4RFhuMcU-xCU8,"4,6","9,9 rb","Jl. Asia Afrika No.112, Cikawao, Kec. Lengkong, Kota Bandung, Jawa Barat 40261",(022)4232244,Hotel bintang 4,"Kolam renang: Kolam renang di dalam ruangan, Kolam renang khusus dewasa, Kolam berendam, Pengawas kolam renang, Bak air panas; Internet: Wi-Fi, Wi-Fi di area publik, Tempat kerja dengan internet publik; Kebijakan & pembayaran: Properti bebas rokok, Kartu kredit, Kartu debit, Pembayaran seluler via NFC, Tunai; Layanan: Resepsionis, Penyimpanan bagasi, Concierge, Penatu layanan lengkap, Penatu swalayan, Elevator, Toko suvenir, Tata graha, Layanan turndown; Parkir & transportasi: Tempat parkir, Parkir mandiri, Parkir valet, Jemputan bandara, Layanan mobil pribadi; Aksesibilitas: Ramah difabel, Fasilitas parkir difabel, Lift bagi difabel, Fasilitas kolam renang difabel; Hewan peliharaan: Hewan peliharaan tidak diizinkan; Kamar: Ber-AC, Lemari es, Microwave di beberapa kamar, Mesin pembuat kopi di beberapa kamar, Minibar di beberapa kamar; Makanan & minuman: Restoran, Bar, Pesan tempat makan, Makan malam prasmanan, Room service, Sarapan, Sarapan prasmanan; Aktivitas: Toko butik; Anak: Cocok untuk anak, Pengasuhan bayi, Aktivitas untuk anak, Klub anak-anak; Kesehatan: Gym, Treadmill, Angkat beban, Pijat, Spa, Dokter panggilan; Bisnis & acara: Business center, Ruang rapat; Bahasa yang digunakan: Inggris, Indonesia; Kamar mandi: Kamar mandi pribadi, Bak mandi di beberapa kamar, Pancuran; Efisiensi energi: Program konservasi energi, Penggunaan energi diaudit oleh organisasi independen, Sistem pemanas dan pendingin hemat energi, Pencahayaan hemat energi, Termostat hemat energi; Pengurangan sampah: Program daur ulang, Program pengurangan sampah makanan, Kelebihan makanan dikompos, Zat berbahaya ditangani dengan aman, Elektronik, baterai, dan bola lampu dibuang dengan aman, Tidak ada wadah makan dari stirofoam; Konservasi air: Penggunaan air diaudit oleh organisasi independen, Keran, toilet, dan shower hemat air, Program penggunaan ulang handuk dan linen; Pengambilan sumber daya yang berkelanjutan: Kebijakan pembelian yang bertanggung jawab, Makanan dan minuman organik, Makanan dan minuman dari bahan-bahan lokal, Hidangan vegetarian dan vegan; ","Lat: -6.9218556, Lng: 107.6102631",http://lh5.googleusercontent.com/proxy/nO5-LOAA9qzePQ_Ia-Z_xkg9k8XhvomxRtX6MpLN4ZiTaXKKkpVXBIXg7o7pnhpgMVxQWp-gsHNAcn0OiC48b3yj43v9UoYmWte6-W2t9pE54-3mKL4De0pFSiZ0qpKTf1ruBqaqSebV8Tyl4jMBjns8nFaZBA=w252-h169-k-no; http://lh5.googleusercontent.com/proxy/KjJqJ6QmZ6AaULNVQJbanY1PMEg9kXCdEDMRAthVH2753YJS9Sp25Fq4fRoTy3Tl_fizQFC_UTTBLlcQW3kVLefZPR1gNYQRU43TrS96K6m4GWF3jv5CreSDBunI4_CaZYMtbsXgek-zBW9Qq_bhASDAFIAm_g=w252-h168-k-no; http://lh5.googleusercontent.com/p/AF1QipMOhBJOYR8KC8tmQG-tSQcGUir7uwIjSK5PLEHs=w252-h167-k-no; http://lh5.googleusercontent.com/p/AF1QipPm-oUFCo-5RVS-FnH_ZZYtrJo1CcysY7sB7tQ0=s367-w367-h248-n-k-no; http://lh5.googleusercontent.com/p/AF1QipPXFrb1YUmn1wM0DwZgyPzJC-T_HDEr0vTbmXcl=s367-w367-h248-n-k-no; http://lh5.googleusercontent.com/p/AF1QipMZYwMySRIb7rgYTRY_wjlDuXyG9O-s6xj84VzH=s367-w367-h248-n-k-no; http://lh5.googleusercontent.com/p/AF1QipMaRwSDJ-CHYCRrAJW5xeYnwiu5x8fCXa5rXnSl=s367-w367-h248-n-k-no; http://lh5.googleusercontent.com/p/AF1QipN3jAKQcj-ULsrufqFotBwccDSz0wlGXiGyKF1-=s367-w367-h248-n-k-no; http://lh5.googleusercontent.com/p/AF1QipNbEOJtjorB4HoWTnQb7nNCtEsF8rLtExSQz_nw=s367-w367-h248-n-k-no; http://lh5.googleusercontent.com/p/AF1QipOsFnsf5l-LVNzmoOCFHodq1RwPoXZx9y0VAKYg=s367-w367-h248-n-k-no; http://lh5.googleusercontent.com/p/AF1QipOyF3x5NWfHpAD8AtCIjZIyO5KztBUBZqisPMzf=s367-w367-h248-n-k-no; http://lh5.googleusercontent.com/p/AF1QipMaSAqXOAd-DyWlVDtzkAqrGZ0B4CGaREY8xTG9=s367-w367-h248-n-k-no; http://lh5.googleusercontent.com/p/AF1QipMKE8_x-zplR7BluN7s7RT7QCMKoNEd9k0mOFUT=s367-w367-h248-n-k-no; http://lh5.googleusercontent.com/p/AF1QipPszWYCftqIFBTugy4dbylQ7zaqeJbKPP8Hxwaz=s367-w367-h248-n-k-no; http://lh5.googleusercontent.com/p/AF1QipMXEdXlDD2FDaZEbwuRWTKJCkoyKctmYoVHoXlO=s367-w367-h248-n-k-no; http://lh5.googleusercontent.com/p/AF1QipPsDDIc120oaRRc9wU3k5V2-F_TzzKD9g5Nuk3E=s367-w367-h248-n-k-no; http://lh5.googleusercontent.com/p/AF1QipP2R-WN0o5MusPXIQXM_7meA5LGF-FS9jN8Brr0=s367-w367-h248-n-k-no; http://lh5.googleusercontent.com/p/AF1QipO7SCGRd6Yalz2kmdO0uebXO6o72V9H5Qtb1BMt=s367-w367-h248-n-k-no; http://lh5.googleusercontent.com/p/AF1QipPnjtJFspnxzA1sHTHR_AVr6sKpHvS2V7q0yccV=s367-w367-h248-n-k-no; http://lh5.googleusercontent.com/p/AF1QipNYcIx7eN_qLjz9ZbhI5-zn0FwCOwcBI5RbROkq=s367-w367-h248-n-k-no; http://lh5.googleusercontent.com/p/AF1QipOj9iGj3emNbqHQdQRukyWy2akzMV0cRZt3orWE=s367-w367-h248-n-k-no; http://lh5.googleusercontent.com/p/AF1QipOcv7xaQKiJi2dIJVjSIgZwGG5AAap2oybBri8p=s367-w367-h248-n-k-no; http://lh5.googleusercontent.com/p/AF1QipOCWbV7zN73ObeBf20mMmg1zLRQLAivwfblykGG=s367-w367-h248-n-k-no; http://lh5.googleusercontent.com/p/AF1QipNISr0-Bxj8hJi4XJO8VLG60kbY4I9-4Jr21ok4=s367-w367-h248-n-k-no?w=1024
ChIJzTqHb2DmaC4RmwJYrF_Ni5I,"4,4","4,1 rb","Jl. Sukajadi No.148-150, Pasteur, Kec. Sukajadi, Kota Bandung, Jawa Barat 40162",(022)2039888,Hotel bintang 4,"Kolam renang: Kolam renang di dalam ruangan, Tak ada bak air panas; Internet: Wi-Fi; Layanan: Resepsionis, Concierge, Minimarket, Penatu layanan lengkap, Tata graha, Layanan turndown; Parkir & transportasi: Tempat parkir, Parkir mandiri, Parkir valet, Jemputan bandara; Aksesibilitas: Ramah difabel, Fasilitas parkir difabel, Fasilitas kolam renang difabel; Bisnis & acara: Business center, Ruang rapat; Kamar: Ber-AC; Makanan & minuman: Restoran, Room service, Sarapan, Sarapan prasmanan; Anak: Cocok untuk anak; Kesehatan: Gym, Treadmill, Mesin beban, Angkat beban, Pijat, Spa, Dokter panggilan; Hewan peliharaan: Hewan peliharaan tidak diizinkan; Bahasa yang digunakan: Inggris, Indonesia; ","Lat: -6.8890012, Lng: 107.5969913",http://lh3.googleusercontent.com/proxy/MfC61bzhOuLnMYpE2UmnRdO-znzFWQRF1kF26c9v8mmgVl2pzxs-hd36zkGjvsu_5qwjU01t-Zfktu98Fw6hD-P2b6Uy1bh2xRdf3CCesxUgnnC7qiAhrcaZN1pWBRHLy0n0QjtuBQuiH1fIKJrcOZkCY5i8A5s=w252-h167-k-no; http://lh3.googleusercontent.com/proxy/mcg_oWIMz2TkxhKAJhCUYSEWmLvSl3QvP-oKrXKpJ4DVBq0Wy4lAP2MvKF5O9AmZjXbTSZrysdWqQcoUEs8Vm5AeWqT6914-P6PzK4qqXiTfqgM8y9LaPiVTjiuOhMXvobfEN4_2tXDr-ewLjWASulid6Rk7_Yc=w252-h175-k-no; http://lh5.googleusercontent.com/proxy/9gaYaPmIhyzsdTEQRzTrxAUPdIU1sNihrivKluJ_xixe7XVGj5q- ixOZ2RQae4Ct61t0yJjJq933oYDbty3fLFdvFvM8CSKlLEz8xDCMpCIcdPYRcBXp74g2SIMaaN1PoTegMgN3Kfp9KtelaDJ0zEbphQjTfA=w252-h163-k-no; http://lh5.googleusercontent.com/p/AF1QipPUt-ZmprWrR93kWj17Fdyc1Qx1-45Ar1IQykZb=s367-w367-h248-n-k-no; http://lh5.googleusercontent.com/p/AF1QipN4yLvvKzcISKFV0C4-yZ3kOQxaeadcuMphIbY=s367-w367-h248-n-k-no; http://lh5.googleusercontent.com/p/AF1QipMjeCd19WVAtBihx2OV0GRH7-bdAr1tM2FpLk0B=s367-w367-h248-n-k-no; http://lh5.googleusercontent.com/p/AF1QipOLo4MFanb2ywiqVtpsNEHNkM6R_F6vLhrWRL_y=s367-w367-h248-n-k-no; http://lh5.googleusercontent.com/p/AF1QipMp1Im9v_zOs4w5ElRqdZkzTQ18H8-q8MmHyTpj=s367-w367-h248-n-k-no; http://lh5.googleusercontent.com/p/AF1QipPNdYCQTvuj3iFZWg6-ogLSGmUlgxPu8JLLeybW=s367-w367-h248-n-k-no; http://lh5.googleusercontent.com/p/AF1QipMFT7dbsuwKSn_NtNI6jqnp_aPgdbjktim5gnOp=s367-w367-h248-n-k-no; http://lh5.googleusercontent.com/p/AF1QipNj2YhZs9wDSDmzAmC6efYnh3spI-3joiQnEf_A=s367-w367-h248-n-k-no; http://lh5.googleusercontent.com/p/AF1QipOP4l4aQNAv2E8EUhDsVl4vF3nz6qDZ4_A3md26=s367-w367-h248-n-k-no; http://lh5.googleusercontent.com/p/AF1QipMZ2DfM9zp4PjGT0EsSo_6CUQYIXGdoYj2HxWEp=s367-w367-h248-n-k-no
ChIJVQy_Fy_maC4RG_emrQUP3B0,"4,5","7,5 rb","Jl. Asia Afrika No.81, Braga, Kec. Sumur Bandung, Kota Bandung, Jawa Barat 40111",(022)4231631,Hotel bintang 4,"Kolam renang: Kolam renang luar, Kolam renang khusus dewasa, Kolam berendam, Tak ada bak air panas; Internet: Wi-Fi, Wi-Fi di area publik, Tempat kerja dengan internet publik; Kebijakan & pembayaran: Kartu kredit, Kartu debit, Tunai; Layanan: Resepsionis, Concierge, Minimarket, Penatu layanan lengkap, Elevator, Layanan membangunkan, Tata graha, Layanan turndown; Parkir & transportasi: Tempat parkir, Parkir mandiri, Pengisi daya EV, Jemputan bandara, Penyewaan mobil di tempat, Antar-jemput lokal; Aksesibilitas: Ramah difabel; Bisnis & acara: Business center, Ruang rapat; Bahasa yang digunakan: Inggris, Indonesia; Kamar mandi: Kamar mandi pribadi, Bak mandi di beberapa kamar, Pancuran; Makanan & minuman: Restoran, Bar, Pesan tempat makan, Room service, Sarapan, Sarapan prasmanan; Aktivitas: Ruang game, Toko butik; Anak: Cocok untuk anak, Aktivitas untuk anak, Klub anak-anak; Kesehatan: Gym, Treadmill, Mesin beban, Angkat beban, Pijat, Spa, Dokter panggilan; Hewan peliharaan: Hewan peliharaan tidak diizinkan; Kamar: Ber-AC, Dapur di beberapa kamar, Lemari es di beberapa kamar, Microwave di beberapa kamar, Mesin pembuat kopi, Minibar; Efisiensi energi: Program konservasi energi, Penggunaan energi diaudit oleh organisasi independen, Sistem pemanas dan pendingin hemat energi, Pencahayaan hemat energi, Termostat hemat energi; Pengurangan sampah: Program pengurangan sampah makanan, Kelebihan makanan didonasikan, Zat berbahaya ditangani dengan aman, Elektronik, baterai, dan bola lampu dibuang dengan aman, Tidak ada wadah makan dari stirofoam; Konservasi air: Keran, toilet, dan shower hemat air; Pengambilan sumber daya yang berkelanjutan: Makanan dan minuman dari bahan-bahan lokal, Hidangan vegetarian dan vegan, Perlengkapan mandi ramah lingkungan; ","Lat: -6.9210166, Lng: 107.6117308",http://lh3.googleusercontent.com/p/AF1QipP7P0nzvdUqmgscP2-bWSN9lzflezx8RzijHXtB=w252-h448-k-no; http://lh5.googleusercontent.com/proxy/bD-VmFVFUxk1kVXP9Qjp2qRSTgr_YdKE3uoNkRb4dZzIe14ynFglQU4FLtekQqpMt5BzlopPmBEWCVelj0JF3PMvgzWSxXBPTL3hzPBScyl5erVPRebF-ZLyaLS9hJnc_fuFzuuQD4cJuzQQ8LVY4de06gjUUA=w252-h168-k-no; http://lh5.googleusercontent.com/proxy/Oa4DYuxTeQ0fEH6k7-NDsGRnP0OLkNY7CKXjbBe3I9FuIACVEwzaKbShkNDbpTFGFKhHDc20JZWuXJWr8UKRzVwAd9uGB5B13pxPkU6nnlNA17BhCuDh9R8jPTt7DhnKxSXdEkcg92twuDEK_SUV9D5ynUA22A=w252-h168-k-no; http://lh5.googleusercontent.com/p/AF1QipPsFPBHuwB1PxC_tImyfjJG7mxBflQGd_r3meEC=s367-w367-h248-n-k-no; http://lh5.googleusercontent.com/p/AF1QipNB4c8yhSR7_TG8k__pUFNX25XjNGVi7FZ8gXY8=s367-w367-h248-n-k-no; http://lh5.googleusercontent.com/p/AF1QipNfMBw5ZDw1728g_X-wGy1QHkKzjzDTUky6aBgs=s367-w367-h248-n-k-no; http://lh5.googleusercontent.com/p/AF1QipOHpPAxkaX7I4U3K2q0LTzP2wtYpN1cQnE7r22T=s367-w367-h248-n-k-no; http://lh5.googleusercontent.com/p/AF1QipMwRgG2cJbolFOREMi1z8P4DRZ1wOMLYvrwOrF3=s367-w367-h248-n-k-no; http://lh5.googleusercontent.com/p/AF1QipMS7R-MpPn_2eval3E3XrhNw-h8gZWhyJMp8s2X=s367-w367-h248-n-k-no; http://lh5.googleusercontent.com/p/AF1QipPap76oMYV01vP5NpR6JW6zKGWwG03FALa-UZyL=s367-w367-h248-n-k-no; http://lh5.googleusercontent.com/p/AF1QipNptXpY_gWRCaSaMOFKpPjMUj4mOzLVYlOhLJnD=s367-w367-h248-n-k-no; http://lh5.googleusercontent.com/p/AF1QipPZiS9OKaJwTB4rw86NQfhRpgL_pe2oQ0sZTVSk=s367-w367-h248-n-k-no; http://lh5.googleusercontent.com/p/AF1QipNBt633Ifwisqjh09lyzaI07jDdAe3gOyMoQDz2=s367-w367-h248-n-k-no; http://lh5.googleusercontent.com/p/AF1QipNQASrrGWZLEc4lcfz64OUDzQp-XfztyHOJnfs=s367-w367-h248-n-k-no; http://lh5.googleusercontent.com/p/AF1QipM54EwjHaTstwAre269hQlvFiN7PhluufYBtQw=s367-w367-h248-n-k-no; http://lh5.googleusercontent.com/p/AF1QipNiON862yZhw9NONNU6Ij39icYxrB3TJ-UfRvM=s367-w367-h248-n-k-no; http://lh5.googleusercontent.com/p/AF1QipN3dhRwrBTJPxX7BqsiAJxrSXWbyEESiN0JxdQ=s367-w367-h248-n-k-no; http://lh5.googleusercontent.com/p/AF1QipPZHR2G5ss75T4X2xaaNJYy-1sDhitlIU4tWtE=s367-w367-h248-n-k-no; http://lh5.googleusercontent.com/p/AF1QipNZL2fIProKlDTRJcWnI-og6NoFAK4RBqMC_YK6=s367-w367-h248-n-k-no; http://lh5.googleusercontent.com/p/AF1QipMQF_y5hpPpQMlnJzrCgLhQfWAIUPqlVOfClwUf=s367-w367-h248-n-k-no; http://lh5.googleusercontent.com/p/AF1QipO0RFnvqnTZViX5GgjkosBf8canAeh3SHyCUnZC=s367-w367-h248-n-k-no; http://lh5.googleusercontent.com/p/AF1QipPmwRA3jT0v8vTkK4iQN0YEelSFiZB7R_63huPh=s367-w367-h248-n-k-no; http://lh5.googleusercontent.com/p/AF1QipPDt0yEfzWmKM5FUf1_SNIn_SHffA4Jsn8g3mDN=s367-w367-h248-n-k-no; http://lh5.googleusercontent.com/p/AF1QipOroQ-5vhYss9TOz4ZJPgsPHrpmLGzFP6bbUnPz=s367-w367-h248-n-k-no; http://lh5.googleusercontent.com/p/AF1QipNbZ6GvyxJk53PsF4y6KoKqCrh2LL9u8xg99x0A=s367-w367-h248-n-k-no; http://lh5.googleusercontent.com/p/AF1QipNM-_kAw1P7R3AHwVr6JNMnY37my9MteqWXgqD5=s367-w367-h248-n-k-no; http://lh5.googleusercontent.com/p/AF1QipMVKWJnlHEGLS7vavkbzDx_XG6qOOFDj76yrnCY=s367-w367-h248-n-k-no; http://lh5.googleusercontent.com/p/AF1QipMP8MKmi9msvyB47ieV85M6BBYPvZGMn26PDwgU=s367-w367-h248-n-k-no; http://lh5.googleusercontent.com/p/AF1QipO-zTuPEi6fB5y8ZLTb8au7o-MSfbwbOSBzuAM2=s367-w367-h248-n-k-no; http://lh5.googleusercontent.com/p/AF1QipMUV9kTRP1FoKBfpu-Aru9I63bc3SnDGihj2xDb=s367-w367-h248-n-k-no; http://lh5.googleusercontent.com/p/AF1QipPs9rr8gCBwkR82hNmEMaaMwS9jSmUh6nNhbYPZ=s367-w367-h248-n-k-no; http://lh5.googleusercontent.com/p/AF1QipNuYCFC09YtWOJWIkePiMZXRGzmTjkP_BZh2O68=s367-w367-h248-n-k-no; http://lh5.googleusercontent.com/p/AF1QipN-BMTvNEi_iazQAhXnLS0FBL4uGpdOBNLie7sO=s367-w367-h248-n-k-no; http://lh5.googleusercontent.com/p/AF1QipNotm7yQO-CYrRSJtmlE1TbDdasTu7Y6pRJQ_N0=s367-w367-h248-n-k-no
ChIJBZahlgTnaC4ROYD3K2Y2E68,"4,2",860,"Jl. Dalem Kaum No.36, Balonggede, Kec. Regol, Kota Bandung, Jawa Barat 40251",895323453298,Hotel bintang 3,"Kolam renang: Kolam renang luar, Tak ada bak air panas; Internet: Wi-Fi, Wi-Fi di area publik; Layanan: Resepsionis, Penyimpanan bagasi, Elevator, Layanan membangunkan, Tata graha; Parkir & transportasi: Tanpa parkir; Aksesibilitas: Tidak dapat diakses; Bahasa yang digunakan: Inggris, Indonesia; Kamar mandi: Kamar mandi pribadi, Pancuran; Makanan & minuman: Restoran, Sarapan; Anak: Cocok untuk anak; Kesehatan: Tidak memiliki gym, Tidak menyediakan spa; Hewan peliharaan: Hewan peliharaan tidak diizinkan; Kamar: Ber-AC, Mesin pembuat kopi; ","Lat: -6.9223224, Lng: 107.6051711",http://lh3.googleusercontent.com/p/AF1QipMAYO-I3W2GzbFhWmyGSNCYB4gvS1JhS4RJyQuY=w252-h448-k-no; http://lh3.googleusercontent.com/gvs/AG4uZQlweHtJ1TMfaoB73XUHC7QpcT9LPZhVBGCN55R07ZZlHJ7yzViTgxADtdODFfzvD19xwWEr3AgKYzmD1DOf0WXby2VOIlC_5ZZq; http://lh5.googleusercontent.com/p/AF1QipPiwMw1zBwJBkS7d_5qJGly5Cl5AxIQrOb1Xzik=w252-h179-k-no
ChIJ74kCFYjpaC4RrhmSI-cU7JM,"4,4","3,3 rb","Jl. Pelajar Pejuang 45 No.123, Turangga, Kec. Lengkong, Kota Bandung, Jawa Barat 40264",(022)73514111,Hotel bintang 3,"Kolam renang: Kolam renang di dalam ruangan, Kolam renang luar, Kolam renang khusus dewasa, Seluncuran air, Kolam arus, Taman rekreasi air, Bak air panas; Internet: Wi-Fi, Wi-Fi di area publik; Kebijakan & pembayaran: Kartu kredit, Kartu debit, Tunai; Anak: Cocok untuk anak, Aktivitas untuk anak; Aksesibilitas: Ramah difabel; Hewan peliharaan: Hewan peliharaan tidak diizinkan; Makanan & minuman: Restoran, Pesan tempat makan, Makan malam prasmanan, Room service, Sarapan, Sarapan prasmanan; Layanan: Resepsionis, Penatu layanan lengkap, Elevator; Parkir & transportasi: Tempat parkir, Parkir mandiri; Kesehatan: Gym, Treadmill, Tidak menyediakan spa; Bisnis & acara: Business center, Ruang rapat; Kamar: Ber-AC, Mesin pembuat kopi, Minibar di beberapa kamar; ","Lat: -6.9361598, Lng: 107.6241269",http://lh3.googleusercontent.com/p/AF1QipMXufs8N5IPkbuX66fokQgH3Wt_zO654ajTBReK=w252-h448-k-no; http://lh5.googleusercontent.com/p/AF1QipMjr3SnnktSUgtfO-RiQX7VziVqm4cDsSFgVGej=w252-h336-k-no; http://lh5.googleusercontent.com/p/AF1QipOkA4UVdX3V__Z14OBoeEMd5GHvhnTMszox5NOE=w252-h189-k-no; http://lh3.googleusercontent.com/gps-cs-s/AB5caB9OFplbh-xXcu_xhKHHWqvriix6EPPY_uL0mNGW-tDfqz5wsC3yQJcUeR7pCtgyRHswart6uKev_-czOLS8feWBmS2uLbc-8zYYJ2LMEdRrGJegS_fA8OEEVYCuw4J7pf4r7mefpA=s367-w367-h248-n-k-no; http://lh3.googleusercontent.com/gps-cs-s/AB5caB_D-SRY1Pp6kV_4J4vNrYGX1ajSyvPzrQf8ENgIHIE0x1-Aa3GoOQtmaQL_0oZGqPWwhkCnF1eKYtNuDWrS92JNu6_-K7BifhyWd3pG7kMkumzTBCT1p84yzlsU5TU5LlLuwOHwTA=s367-w367-h248-n-k-no; http://lh3.googleusercontent.com/gps-cs-s/AB5caB9g208nS2riiH2C-wIDUfNqxboFgTOTgEtpyZE_g94r6I5PzFLtWKy4OEgOoacGgUrzN4OJ5-Uyi4TQY2of7QzIduLaGTrhVFNUJnJb9cjtm2Oww9aXTYDNu5EGYhtiE4o6X1zv7A=s367-w367-h248-n-k-no; http://lh3.googleusercontent.com/gps-cs-s/AB5caB8Tg0zPyG12O4U6SAoa83hzqo6ho1Nx3mAECWbBuA9rYLQenCLlP_TOCLkJ0NQ3zgK9prfYA9fDLfqWO2A7tepi9ockf3neUyWNhH3tFqL9Ckzcpsk8kC0T3zMj_rfpDXJJcxSF=s367-w367-h248-n-k-no; http://lh3.googleusercontent.com/gps-cs-s/AB5caB_WYhU4fNCghHBUf-SDmvQR9F_aPe6Won7Ki8u4foxXBr9IzPptduKrpvIIMsyuUpxi-fmq3A5u46NsM9ToGFrwzf1b_Nb-HymVPSTOqpPADJtwWAbKMQYPY8ygIeFkfWrlw1OL=s367-w367-h248-n-k-no; http://lh5.googleusercontent.com/p/AF1QipOJRFBDR_dG0EqThy3aygGC44V4U9jx8sUvAFs=s367-w367-h248-n-k-no; http://lh5.googleusercontent.com/p/AF1QipPf9MLI97yBR0m4npIkdfHsJlOSanI81C3mIgI=s367-w367-h248-n-k-no; http://lh5.googleusercontent.com/p/AF1QipNMuOdzcaJmFEWxlXzZjPTwdhVUQCjGzLqTsPw=s367-w367-h248-n-k-no; http://lh5.googleusercontent.com/p/AF1QipPgE5kQjMqPGzp7AzuGLAC8juDqm0hppds1L0w=s367-w367-h248-n-k-no; http://lh5.googleusercontent.com/p/AF1QipN57MFSvxkPmmW1DOxMFfTIHrOAk4mHNAXQU2k=s367-w367-h248-n-k-no; http://lh3.googleusercontent.com/gps-cs-s/AB5caB8emPr0rI1Xqi_QLqsDWlYdX-t1ASzeKl3vNbVQDRboK2M4czBwiYY1CbRqYKPmk1Y8czQxstfCPzX-JmbOVYdQrp_bd5_PoUf3Wzw79K6T3m09wK_eXIKmBV4_jYPCBzuMaL-ycg=s367-w367-h248-n-k-no; http://lh3.googleusercontent.com/gps-cs-s/AB5caB_p3i3PMS2frkiLEnr5aQspedP1FVybowhGP8bKKQniM4YW93hXkuxIIIXtBGzvC4MNnMByQtyPY8D0-kmiHOXN82ZHV0lhjudXVtbOMqU2SaAHRLOVQxQ-4R9glOeUcIVr_qq-=s367-w367-h248-n-k-no; http://lh3.googleusercontent.com/gps-cs-s/AB5caB-t3HmiWn4dBVEmqSa_avldHpzu1_4B4o_fWAfcu_SckJfoRy0iF4K85UobvEiEwlPXzaCZCCCe-YL8LPIAeAa_vpWwMgbWycNw1uaYU8bFIPxwr-8lDRaj6UpsYG6tECyS6BlYUw=s367-w367-h248-n-k-no; http://lh3.googleusercontent.com/gps-cs-s/AB5caB9T39TlEwBFl_luNNsslLOw4OiQ8ZbsbT7eIY_pGdTLBgWV0IqZOYyD5awIWBF6BFJb3mqn97Gg44B-9v8g8VBri8xRze5NHjviSTU2c4qcIW8xUBWlUGvpK5uvpzkxrBif1_Fl=s367-w367-h248-n-k-no; http://lh5.googleusercontent.com/p/AF1QipM5Ybs4ZPwqxM97BaLE1zBcLZUJRwJ4-fUF81fC=s367-w367-h248-n-k-no
ChIJh4pQXj3maC4RLAm7bM1eg1k,"4,2","1,2 rb","Jl. Gardujati No.81-83, Kb. Jeruk, Kec. Andir, Kota Bandung, Jawa Barat 40181",87784841793,Hotel bintang 4,"Kolam renang: Kolam renang luar, Kolam berendam, Tak ada bak air panas; Internet: Wi-Fi; Layanan: Resepsionis, Penatu layanan lengkap; Kesehatan: Tidak memiliki gym; Kamar: Ber-AC; Makanan & minuman: Restoran, Room service, Sarapan, Sarapan prasmanan; Anak: Cocok untuk anak; Parkir & transportasi: Tempat parkir; Hewan peliharaan: Hewan peliharaan tidak diizinkan; ","Lat: -6.9172115, Lng: 107.5981514",http://lh5.googleusercontent.com/p/AF1QipMnv5UXT6N1UH_Hw6Y2sHJby3XG9u01aRBBn2Sn=w252-h252-k-no; http://lh5.googleusercontent.com/p/AF1QipOg8y7lGubf1F8bwZgLp-0QRVv7n9MythM_vHvf=w252-h168-k-no; http://lh5.googleusercontent.com/p/AF1QipNiCgnWrxgVqWkfi3Ms_y9INfGVYijmpqnTRIdB=w252-h167-k-no; http://lh5.googleusercontent.com/p/AF1QipOpOOt2tMUwWp286KdWe5qHGQM4ktL0uC2AlIsL=s367-w367-h248-n-k-no; http://lh5.googleusercontent.com/p/AF1QipOyJe4LwI2Na4vcZ8-hq99FR-73nrAJqVIYklsb=s367-w367-h248-n-k-no; http://lh5.googleusercontent.com/p/AF1QipMOJpM9fCxdW8Dw0AEg1nMeEO5kjp9hgFBuUdJI=s367-w367-h248-n-k-no; http://lh5.googleusercontent.com/p/AF1QipNgBA8oBoWG8isHQ-JNaI4Ywd_n3mFEuSc5F4Ax=s367-w367-h248-n-k-no; http://lh5.googleusercontent.com/p/AF1QipN6LsstOafN2BNGp_mU3ZUhZ4fSkz7voMTq966B=s367-w367-h248-n-k-no; http://lh5.googleusercontent.com/p/AF1QipOYesJ_J0F3Eib6s5FAcewIiXpXTorY3o_51wMQ=s367-w367-h248-n-k-no; http://lh5.googleusercontent.com/p/AF1QipOJTMETeuFArUamEuASEmZ87qxuQ1LfNEA5OUE=s367-w367-h248-n-k-no; http://lh5.googleusercontent.com/p/AF1QipO9sxpkXOISwonGz40MAyheA-lxRjKHT7eQgGc=s367-w367-h248-n-k-no; http://lh5.googleusercontent.com/p/AF1QipPOd-APEwH7kvkIeL8GeFErGBUcwnTocf0eKqi_=s367-w367-h248-n-k-no; http://lh5.googleusercontent.com/p/AF1QipNmSPN9od8VFhM_il9wgqU25uk0fr4q6Ta2HSEH=s367-w367-h248-n-k-no
